Query,Video ID,Title,Transcript,Opinions
The Finals Season 4,RAVyAwBl32Q,Is The Finals Being Gatekept? (Season 4),in today's video I kind of want to go a little off the cuff I'm not going to add any infographics no fancy editing just me talking to you about some thoughts bouncing up here in my Noggin I've seen more than enough posts on Reddit as well as comments on my YouTube videos saying the same things as to why this game is not doing as well as it should reasons such as having subpar quality the balancing sucks too many cheaters and monetization is horrible when the reality of it is some of these statements are far from the truth and the rest are problems that every FP s has to an even higher degree the quality of this game in my opinion is in a league of its own with a team that is significantly smaller than that of a major AAA Studio the balancing is always being modified because they are actually listening to the players regardless if the suggestions are good or bad now they might not give you exactly what you want as an individual but the fact is they're listening to what the majority of the player base want and saying that they don't listen at all is a grossly false statement at the least as for cheaters please tell me what game is completely free of them while you're at it please tell me what game you can manly report them to Discord where a person can actually take a look at the evidence I'll wait because I don't know if it's just me but whenever I've reported a cheater in game three out of five times I would get a confirmation within the next week that they've been banned now if you are an ordinary player that reports someone in Apex Legends good luck because you're more than likely going to see that player in the top 700 at the end of the season facing no repercussions whatsoever and hell in war zone you could even make a career out of cheating in fact the finals has taken the first steps to combat software such as rewas to which other games had to take notice and start following suit I can go on and on about this topic but trust me the grass is not greener on the other side believe that and as for monetization the prices are not only fair but they even allow you to buy particular items from a bundle that you want rather than the entire bundle itself and for this current Halloween event you have the opportunity to get 27 free rewards and these rewards are not just stickers or charms some are actually quality skins whether or not the player is actually able to obtain them all is a different story but still the fact of the matter is there is a ways and means of potentially receiving them for free in contrast to apex's collection event which gives you a charm sticker or depending on how much they've pissed off the player base maybe even a skin now that we have a little perspective it is in my opinion that these are not the reasons why the finals is not doing as well as it should it is simply because players don't want to throw away the skill acquired from the game they are currently playing just to start all over again from scratch with something new even if that new game is Superior in every single aspect the majority of players just don't want to throw away that time invested this is particularly because of the increasingly competitive culture we live in today where everyone wants to be a well-known streamer or the best esport athlete known to man to sweat their balls off with the best of them and playing the game is for potential monetization rather than just for the fun of it this is blatantly clear with the abundance of TTV or kick names that you see in every other match no offense to anyone that does stream but this is just the reality of things because in order for this game to really find huge success is for one of the big four to fail which is Apex fortnite Call of Duty or OverWatch I know there are a lot of other huge titles but these are the most similar in terms of gameplay to the finals my point being is that Embark needs to play a game of patrici by making sure that the finals is in a great state so that when not if one of these big four fail the finals will be ready to receive a huge chunk of the players in the power vacuum the game Left Behind allowing it to finally achieve the recognition it deserves now failing can come in many ways not just by low player population it can also come in the way of people just having enough enough of their money time and effort being taken advantage of and when that time comes the finals will be waiting for them with open arms so if you're a player that's sitting on the fence thinking to yourself I don't know if I want to give this game a solid chance because I've invested way too much time in a particular game I want you to remember this because it took me a while to realize it as well that the fundamentals of aim such as Target acquisition click timing and tracking are consistent throughout all these major titles some may heavily rely on one aspect than the others but in general if you have solid fundamentals of aim you can easily transfer skill from one game to another this is why players like shroud or ASU can hop on to almost any FPS and quickly be proficient at it because they're able to use their fundamentals to find similarities of skill to transfer from one game to another anyhow I'm starting to feel like I'm going on a tangent here and I don't want to keep rambling on but yeah what are your thoughts is it because of bigger games gatekeeping the finals or is it because of other factors that is preventing this game from reaching its true potential I love to hear from you but again keep it civil if you enjoyed this video please drop a like And subscribe for all things to fin us the rest of the video is just going to be game play so peace and love guys and I'll see you in the [Music] arena we play Hal and we in our bement until the to but [Music] [Music] this bement you [Music] [Music] n [Applause] [Music] be basement but you [Music] [Music] [Music] n [Music] we would go to school but I cuz it's hard to read when you got tired eyes [Music] [Applause] [Music],"The reviewer voiced their opinions about the game 'The Finals', focusing more on the overall game rather than specifically the Pike .556 weapon. They addressed common criticisms such as subpar quality, poor balancing, cheating, and monetization. However, they disagreed with these criticisms. According to them, the quality of the game is excellent, especially considering the team behind it is smaller than a major AAA studio. They also appreciated the developers' efforts in continuously modifying the game balance based on players' feedback. 

The reviewer also pointed out that cheating is a common issue in all games, but 'The Finals' has a process where players can manually report cheaters to Discord. They praised the game for being proactive in banning cheaters, mentioning that they have received confirmation of action taken against cheaters three out of five times they reported. 

In terms of monetization, they did not touch on this topic explicitly, but it seems that they view the problems in 'The Finals' as common across all games, or even worse in other games. They highlighted that 'The Finals' has taken steps against cheating software, setting an example for other games. 

Overall, the reviewer seemed to hold a positive view of 'The Finals', but did not provide any specific feedback or opinions on the Pike .556 weapon. The text doesn't provide specific opinions on the weapon balancing or on the pike .556 in the game 'The Finals'. The discussion is more focused on the game's monetization, events, player retention, and the state of the gaming industry. It mentions the fairness of prices and the possibility of buying individual items instead of entire bundles. The text also talks about the potential to get quality skins through free rewards. The reason why 'The Finals' may not be doing as well as it could be is attributed to players not wanting to abandon skills acquired from other games. The competitive culture and the desire to become a well-known streamer or esports athlete is also discussed. The text suggests that the game needs one of the big four games (Apex, Fortnite, Call of Duty, or Overwatch) to fail for it to find huge success. The provided text doesn't include any specific opinions about the weapon balancing or the Pike .556 in the game 'The Finals'. The text primarily discusses the potential for 'The Finals' to gain a larger player base if other major games fail to satisfy their players. The speaker also emphasizes the transferability of fundamental aiming skills across different games, and mentions well-known players like Shroud and ASU who can quickly master various games due to these transferable skills. This suggests that players might be able to quickly adapt to using the Pike .556 if their aiming skills are solid, but no explicit assessment of the weapon is provided. I'm sorry, but without any pre-existing context or text, I can't extract opinions or provide detailed information about the Pike .556 weapon in the game 'The Finals'. Please provide relevant information, comments or discussions for me to analyze."
