Query,Video ID,Title,Transcript,Opinions
The Finals pike .556,48zXxuqHzuw,Is The NEW Pike 556 REALLY Any GOOD?… (The Finals),"behind you yep oh oh my God I dropped him on me that's funny they're above they're above killed one purple sword light on me sword light on me oh wow God it's so annoying oh yep on me killed him there it is they're behind you behind dead dead dead oh [ __ ] thank you what a wrap around by this guy he's dead he's dead kill the heavy killed him dude is [ __ ] camping Behind these guys are killed one pink up here with us that was a stupid Push by him nice last one's across I'm [Music] pushing he's about to got [Music] him the arena has loaded buck [Applause] I can't demo there we go one dead one dead one dead I'm dropping down I'm going straight to a that one not me I'm with you back nice that's a wipe oh I got nice kill nice skill nice skill SC up here zip line I'm medium get back almost instantly they're here and they're running the [ __ ] broken gun I'm coming I'm coming I killed one now I'm coming back they inside I killed one orange left they're over there they're below they're on me yeah they're right here I've got an angle res res res a there's a guy right kill one I killed one I killed one I killed one they're going to Res they're going to Res hit that res yep I got you I'm watching Jesus thanks for the revive they're coming down bottom left bottom left behind they're behind you behind you dead dead dead oh [ __ ] thank you what a wrap around by this guy I killed him I'm demoing right in nice good teamwork I'm going to take height on the roof it won't let Meo Zine I don't even care if we get it let's just get some kills they've got to be playing inside inside oh I see him that back he's y he's about half and they're behind us to our left too he's dead he's dead killed the heavy good kill it might be too late but here's a good [Applause] try that would have been gas if we got it though purple here purple behind purple Dead one purple dead what the hell that behind me behind me ow ow ow I'm definitely getting pipped ah yeah I shouldn't have peaked up here with us that was a stupid Push by him nice last one's across I'm pushing too he's about to got him making a let's go D or actually let's go c yeah this this going to be a rough he's one I'm watching main staircase I'm with benzo stairs killed him yeah medium on me be careful a Sho here throw it to me throw it to me throw to me I'm putting it in I'm putting it in ow ow ow they're holding hands on me I'm dead I'm dead I'm dead I'm dead it's okay though it's okay I'm not dead heav back of course heav h dude I'm getting no hit rag oh my God I can't ow ow another team third party what dude is [ __ ] camping Behind these guys are killed one pink good shots I didn't have enough health for the confidence I push in there with killed one I'm watching his totem TS kill the other medium that's two dead two de dead let's push dude turrets are so broken dead dead dead all three dead deater should [Music] [Applause] be all my health gone inant one of them coined one of them coined I'm farting on it dude you're [ __ ] kidding me right I'm too I'm coming I'm I'm I'm about to freak out like I don't think I do this right there I dropped it you're good you're good good I'm dropping you I'm dropping you ah my God bro killed their light I killed their light I'm full resing can you just keep an eye out nice just hold bro skillbase hit rag is might actually be real we got it we got it we got it right there ah he's Mark you wanted that kill last second dude 16 and three in rank I'm cooking eating beaver nuggets from bies right now they're so good um you're going to make me hungry let's get into it if you don't have on top orange H orange is one shot if I was more accurate he'd be dead behind you yep oh oh my God I dropped him on me that's funny I love demo I killed one orange heavy I'll take it and then here's they went B I'm going a okay coming back door way oh there's pink on me I see I see I see you where am I getting shot from oh there's two pink wow one orange I wiped him Rive I shot their demo down killed their light here ow ow ow ow enir oh my God I'm coming I'm coming lights he Bas I'm waiting for my demo de he's dead he's dead he's dead might be cheating there's no holy [ __ ] dude they're on it oh they're stealing yeah you got to have the maybe yeah me to you just go straight there orange got it not even P just third as they push station yeah I've spammed it and I'm losing control of the recoil I got to one's in the shed here with us time getting closer just went inis and is going to finish them off we got a we got a playoff hurt teams everyone stay alive hold and I'm dead because moving keep him successful de materialized right here I'm going for it I need stack it's too late I'm too hurt I got to wait to heal before I do anything oh my God I'm [Applause] dead earning oh another uh last one is heavy think there's multiple teams yeah killed one killed two already back their we've killed them so many times we have yeah I'm not worried about any of them I don't think so oh yeah they're pushing in tank one of them's one BR Miss God I'm a [ __ ] cross the map try to hide it God damn they're they're pushing over to [Music] me careful careful careful yikes they're accurate p uh put the teleporter on you they're hitting that zip up to you they're they're thinking about about it underneath you on the ladder nice good kill half Health on one good heals huge heals nice is the other one in here he's below he's below he's below all the way y with you nice like nothing ever happened sorry I'm like locked in right now from the socialites see that's a huge thing they did this season like that oh I want the diamond revive like something to grind for they're coming right here right here Spott up there bro you do not yeah careful they they're going to focus on you where they at uh top mid building I think still they left I think they're going to I think they are too no they're here no they're underneath yeah they're on us EnV are they sounds like they're on D we've got it let's go D if they're on it then we definitely don't have it yet deploying jump pad Crea we don't points for Artic impression but maybe we should killed one orange one just ran out nice I'm going to die but I'm going whoa I'm getting no hit rag on this guy killed one purple dude no way Char ow ow ow are inou right now they'll need up want get to the next round Z here a new Vault our The Bash I'll res dude skill base hit R goes crazy did you see those three shots not register killed him thank you probably going to die yep I'm with you I dropped it one I'm watching dead they coined I think I'm resing body stacking huge I'm playing off distance away they're above they're above killed one purple sword light on me sword light on me oh wow God it's so annoying I'm resing sword light dead they're oh yep on me killed him there it is I got the res 16 and one in ranked I'm eating seven revives damn has has a uh he better become him he um he's actually not bad at stringing no I'm excited bro I got 16 kills first round 16 kills second round so I'm at what 32 32 kills and three deaths right now I'm 32 and three in ranked un our that was the final round whoa whoa whoa head shot dude like if you're going to cheat yeah yeah they're cheating they're cheating they're cheating they're cheating they're definitely cheating the Heavy's the the Heavy's Walling underneath me on the stairs I think dude yeah they're cheating they're 1,000% Walling 1,000% we killed their heavy how does he know one there that's killed their medium kill their medium two dead no no no no you should have seen what they just did to me Kenny dude he I'm I'm using I'm using the goo Thing That Neon does he instantly goes to the edge throws fire thing on me instead of going for you guys this is what I did I went down here I did the neon thing right yeah instantly look instead of going for you guys instantly goes throws a fire directly on me doesn't even go for you guys yeah the the heavy went up here and was waiting for me to go through this door is already aiming for me then we can do how do you already know I'm here hey got to kill him I don't have enough time [Applause] Seasons no anti-che worth mentioning I went 40 and9 and almost beat cheaters that was a gas tournament you know it's bad","This passage doesn't provide a lot of specific feedback about the pike .556 weapon in 'The Finals'. It seems to be more of an in-game communication between players, discussing immediate situations and actions rather than evaluating the features, performance, or balance of specific weapons. The player mentions various actions such as killing opponents, reviving teammates, and positioning strategies but doesn't comment on the pike .556 or any other weapon in terms of its effectiveness, balance, or general opinion. To gather detailed opinions on the pike .556, feedback that directly addresses the weapon’s abilities, performance, and balance in the game would be required. The extracted text appears to be a real-time commentary or chat stream during gameplay and doesn't provide a clear opinion or feedback on the Pike .556 weapon in 'The Finals' game. There's no specific mention of the Pike .556's performance, effectiveness, or how it compares to other medium-class weapons. In order to provide an analysis on this weapon, more direct feedback or opinions specifically focusing on the Pike .556 are required. The provided text seems to be an in-game conversation between players of 'The Finals'. There are no explicit opinions or detailed feedback on the Pike .556 weapon. However, it can be inferred that the player mentions ""losing control of the recoil"" which might imply that they found the Pike .556 challenging to control due to its recoil. Further information or explicit comments about the weapon would be needed to provide a more comprehensive analysis. From the provided text, it can be gathered that the player is having a mixed experience with the weapon, Pike .556 in the game 'The Finals'. The player seems to be successful in eliminating multiple opponents using the weapon, with comments such as ""killed one"", ""killed him"", and ""16 kills first round 16 kills second round"", suggesting that the weapon is effective.

However, there are also instances of frustration, particularly when the player mentioned ""I'm getting no hit rag on this guy"", implying some hits are not registering or there is some issue with the hit detection system while using the weapon. 

The player also mentions ""did you see those three shots not register"", which further suggests issues with the game's hit detection. Additionally, the player seems to be suspecting opponents of cheating, though it's not clear if this is related to the weapon.

The text doesn't provide an explicit opinion on the weapon's balance, but the high kill count suggests the Pike .556 might be powerful. Although, the issues with hit registration could be seen as a balancing factor, making the weapon less reliable.

In conclusion, the player seems to find the Pike .556 effective but also experiences issues with hit detection, and suspects cheating from opponents. The game balance related to this weapon could potentially be adjusted to address these issues. The text provided does not contain specific opinions or feedback on the Pike .556 weapon in the game 'The Finals'. Please provide a detailed review or opinion about the weapon for a proper analysis."
The Finals pike .556,nwWbiDvOLEA,The Pike-556 Absolutely DESTROYS Lobbies in Season 4 of The Finals,[Applause] especially since it still has trouble through multiple layers of walls so it's like it didn't even technically fix that it just feels worse overall okay I'm dead GG's I'm dead I think the shotgun might be the least op for lights but it's still like really really good it's like better than the double barrel for sure what better than the double barrel for [ __ ] sure oh oh oh wow in my op just dashed those double barrel is like still has some good uses and it's not bad by any means but I think consistently you would just pop off more with the hold up with the new shotgun anyway new map is also a huge W by the way oh you can steal from above like this like a head glitch so steal watch my right come up the stairs they might use my hole that's insane I'm so sorry bro bro brother there is just no way that was a cal like I know the moment you said it you realized it was just like Jesus Christ that is a crazy one I thought wor oh man game's lagging slowing my mouse down oh my God I can't even think right now know what is happening we're just going to do this back over here oh everything's breaking oh my God I couldn't I'm so sad no got ITA I actually could have easily stopped that oh my got a mine that's not very CH them I think this cash out mode is just to compensate for the fact that uh oh boy but just to compensate for the fact that it's the test server I don't think this is how cash out's going to be because if so that's it's not as good hands down hands down it's not as good but like when you compens like when you think about the fact that getting making 12 player lobbies or not 12 nine player lobbies is easier than 12 it makes sense oh my God I Whi so much oh oh there was there was a pad oh I didn't see the pad at all GG's I wouldn't have stuck there yeah I may have um I may have Ed like I just said lh1 did get a sight and it's very good I think the weapon is in a very good place now it also has some uh a lot of the inair accuracies it used to have especially like take a jump pad and [ __ ] and you're trying to shoot the midair it would be awful not they kind of removed that so it's in a much better place instead of touching the damage it feels like overall they kind of right something else which is makes me happy oh I didn't mean to do that at all no part of me wants to be I'm lagging so much I can't do anything I bro I'm at 20 yes I I can't do anything my mouse is going like [ __ ] Jesus Christ no I chose the worst Target behind you behind you swear to God I heard somebody land am I high might be he might be high but he somebody did take the jump Pad but like the jump pad wasn't right on me I heard Audio Oh it must have been below I'll oh oh I did not see he got there bro okay I can't ads I can I'm literally holding the ads button it won't do it that's painful oh good [ __ ] good [ __ ] oh my God this what I died to you they're all dead I'm going for the point I died to nice everything's kind of a w that is wild dude I this Barrel he accidentally like shot it that killed me at the end of the fight the little hissing there I just wh LIF again GG's the worst player here hands down oh I should open it I was standing there looking at it you're good bro oh I'm just going to guy yeah yeah yeah he likeed behind big rip to that man's oh hello Mr Pink oh my God that is not St AO was AFK probably had to talk to chat GG's had to happen though AFK get oh my God wait I kind of beam that man oh I got mine I don't care bro this map is so fun for movement actually this map is so fun for movement really is did you just red Barrel him yep Point Blank like dude I love red Barr oh my God my frames yeah my frames just died for a second oh hello random individual I love R i'mm and it's like so strong but why me that's the question I have like why me is it a black thing or like a Mexican thing or like which one it's got to be one of them because I'm not 100% straight that could be it too it could be a lot of things man like I got three things it could be got three debuffs debuffs is what you talking debuffs in the US like come on bro yeah oh I was paying attention I could have stopped that yeah I'm just be mading that that make any noise for me absolutely melted well there's a C4 [Applause] [Music] here English okay is this oh there's a team oh like they wanted to party but they died I hope they revert the scoreboard yeah that they got the revert the scoreboard revert everything else solid W all around yep I'm glad it's out of the meta be real I hatte getting hated when there was two especially when there was three of them like playing against one mod I was like whatever so when it was a three stack of them and they're all just two taing everyone that's where it got obnoxious so if people are going to use other weapons the other weapons are just ass it's so depressing I am not very good at this do you get oh my game I didn't want to fall I need to play enough games to be able to do that cuz I tried the Famas and I did like the Famas I'm getting blown up what is grenading me oh someone's using a c 40 oh no why is the fire oh my God wait you're right you're right bro what did they do with the fire what is that bro it's like a blinding wall of light I think the only thing I don't like right now is just the m so that's a that's a plus though that's an easy yeah yeah that's it also maybe the damage is a little dumb on this but it's okay it's okay to be strong for a little bit oh my this thing feels really slow to turn like right now I don't know why no I got to on oh boy oh [ __ ] oh this is a c 40 guy be careful I know oh God hello mines is he just juking around oh damn that dude's one HP bro place so annoying it's like mines and explosives oh my god oh good [ __ ] oh there's a mine behind you so don't just step back you got it all right good for now oh boy I can't help you in that angle yeah they are not very talented with the aiming but I would swing that because they have two turrets oh hello entire enemy team oh no turret I think i' rather sick of the lh1 than this got to try with the scope no I [ __ ] whiffed I need to get used to the site bro I'm not used to the [ __ ] triangle bro where's that jum pad that's a goat pad right there like what the Hillary strike from someone oh hello one of them one time [ __ ] I will be careful you bring this they have already set up you wouldn't preset it up yeah I'm used to the fter like I'm shoo at the body who they're dead oh when did he get up there what the we got to see what goes on here bro yeah I don't know don't F that one oh what in the ipped her oh well I destroyed that earlier but I guess not you got a GU yeah there's not much I can do I don't like this very bro I pressed Dash twice it just only went off once sounds ay to me okay dude this gameat the second get me out of here bro he dead give me back to my life weapons no I'm out of ammo miss all of them uh I don't know I feel like the sway of the scope is kind of like throwing me off a tiny bit cuz there is a little a little bit of sway not just a free Zoom i e C40 bro dude it's so cring why did they reuff this dog [ __ ] weapon sound like a light main coping right there bro it's so he's just shooting the ground I'm doing like all this movement and he's just like shooting the floor oh he's actually one get didn't he killed himself with his own KN I didn't do any damage to him so I'm glad you did I'm not really yep they nerfed it it's a it's an accidental Nerf they nerfed the dmat big sge please spread it around and I I really do mean this it's actually hard nerfed the I think the intention was there to buff it but the problem is it grabs a lot and when you try to go to close it again it doesn't close everything that you open with with one click like it did before so like it results in a net in a net Nerf because you can't is what you're opening so you have less control than you did before it's like I I I get what the intention was and I think it does come from a good place they defin [ __ ] up really hard [Applause] bro my first won not going lie yeah yeah it's it's just bad now there's no reason to ever run it in my opinion I'm running it just for fun and testing uh cuz you know it's the pest server but like,"The user seems to have mixed feelings about the weapon balancing in 'The Finals'. They believe that the pike .556 still struggles when shooting through multiple layers of walls, suggesting it feels worse overall. They also compare it to the shotgun, which they deem to be the least overpowering for lights but still very good, and even better than the double barrel. 

The user appreciates the new map, mentioning its ability to steal from above and the overall strategic advantages it offers. However, they express frustration over game lagging which they believe affected their performance. 

They also mention a 'cash out' mode, which they think is a temporary feature for the test server; they express that if this mode is permanent, it is not as good as the previous system. 

The user also talks about the difficulties in creating 12 player lobbies and seems to appreciate the changes made to the lh1 weapon which they believe is now in a very good place. 

Overall, it seems like there are aspects of the weapon balancing and gameplay that the user enjoys, but they also have criticisms and areas where they believe improvements could be made. The user's opinion on the pike .556 seems to be negative, indicating they believe it could be improved, especially in terms of shooting through walls. The player seems to have mixed feelings about the Pike .556 in 'The Finals'. They mention that previous issues with midair shooting have been addressed, which is a positive improvement. They seem happy with the damage output of the weapon, and it appears to contribute to their enjoyment of the game. However, they express some frustration with certain aspects of the mechanics, such as difficulties with aiming down sights, which seems to be a recurring problem for them. The player also mentions enjoying the movement on the map while using the weapon, as well as the strength of the weapon. However, they imply it might be unfairly targeted or disadvantaged in some way, though the reasons for this are unclear. Overall, the player seems to enjoy the Pike .556 but also has suggestions for improvements. The player seems to have mixed feelings about the Pike .556 in the game 'The Finals'. They don't seem to like when there is more than one in play, especially when there is a three stack of them, as they view them as obnoxious due to their ability to two-tap everyone. The player also indicates that the weapon might be too strong, suggesting that the damage might be a bit high. However, they also say that it's okay for it to be strong for a while, suggesting that they may view it as a temporary imbalance that can be addressed later. 

The player also feels that the Pike .556 feels slow to turn, which may suggest that they perceive it as a less responsive or slower weapon. They also seem to be frustrated by other players using mines and explosives along with the Pike .556. 

Despite their criticisms, the player seems to appreciate the variety the Pike .556 brings to the game and seems to prefer it over other weapons, which they describe as subpar. They also seem to find it challenging to play against, which could suggest that they view it as a high-skill weapon. 

Overall, the player seems to have a mostly negative view of the Pike .556 due to its perceived overpowered nature and slow responsiveness, but they also see it as a better alternative to other available weapons. They suggest that some tweaks to the weapon's balance could improve their opinion of it. The player seems to have mixed feelings towards the Pike .556 in 'The Finals'. While there isn't a clear cut opinion, several points of feedback can be extracted from the conversation:

1. The player seems to struggle with the aiming system of the Pike .556, specifically the sway of the scope. This is impacting their ability to aim accurately and quickly, and seems to be a key point of frustration.

2. The sound of the Pike .556 is apparently not well-received, being described as 'cringy'.

3. There is some dissatisfaction with the damage output of the Pike .556. The player mentions ""shooting at the body"" but not always getting a kill.

4. The player also mentions an 'accidental nerf' related to the weapon. It seems that some change intended to improve the weapon actually made it less effective or harder to use. This might refer to a mechanic where the weapon 'grabs a lot' and doesn't 'close everything', although it's unclear what this refers to exactly.

5. The player seems to prefer other weapons, as they mention wanting to return to their 'life weapons' and being used to the 'fter'.

Overall, the Pike .556 seems to be seen as a challenging weapon to use effectively. The player struggles with its mechanics and seems to prefer other options in the game. It's unclear if these opinions are widely shared among players or unique to this individual. Further analysis would be required to get a more comprehensive Based on the text provided, it appears that the pike .556 in 'The Finals' has received some criticism. The user believes that the developers have made a mistake in its balancing, making it less effective in the game. This user states there's no real reason to use the pike .556 anymore, except for testing purposes or for fun in the game's public test server. The user's overall opinion seems to be negative towards the current state of the pike .556 weapon, implying that it might need rebalancing to be more useful in gameplay."
