Query,Video ID,Title,Transcript,Opinions
The Finals Medium dmr,wI2y22SelSo,M26 &amp; PIKE-556 Early Gameplay (The Finals S4),how are you alive thank you one of them's one shote on oh my God the hand holding ah [Music] got him yeah once you get used to the shotgun it's pretty crazy got him I killed the one stealing oh my gosh the shotgun is kind of crazy he's dead we got it dude [Music] is this a new map again please please new map I uh I stream normally when Ethan isn't streaming like if I'm playing with Caleb and I mean if you guys want I can stream more yeah if he's got an audience for it then why not map event oh wait they have that it's called Low Gravity you're dang dang darn right tracking Dart operation I tracking darted you and I'll do it again dude I'm doing decent chunk damage to this dude wait there's three darts in the tracking Dart Now tracking them down they used to be two them down up I didn't know that oh they're on the roof I missed all my shots moving follow me okay whoops I was going to push up but uh how are you alive thank you damn tracking darts operationit grenade out them down time to glitch track this guy got to be so annoyed with me nice I'm with you going to go towards B kill him literally one tapped him you just want to go kill uh I think they've already left good this game me too I don't see anyone over there they already left they already already left [Music] think they're under me how do you even come up with that name probably random name I'd assume I'm about to talk watch me launch this on [Music] got him yeah once you get used to the shotgun it's pretty crazy got him that's a team wipe all right I'm terrible I'm the worst I ever play Four no oh God that was just about to change real quick where are they at right here threat detected up there I just destroyed someone uh I got this don't worry guys orang is back oh my God oh my God I'm so dead [Music] I'm running away ah let me move I'm just trying to get in their way we'll see we'll see tracking Dart success got a dart on him nice oh oh whoa time to GL forgot about this turret thank you that's going to be time is flying by [Music] ours reloading enemy spotted down there I'm actually terrible thank you thank you for dying at Walmart oh my gosh the shotgun is kind of crazy dude kind of nutty and might need ad dust it or maybe maybe I'm just good with it who knows W steel oper i di pretty quickly yeah I oh I got third parted they're teaming pink is pushing oh coin in 10 seconds to stay alive no you got it you got it you're chilling we got it 10 seconds got to go for it in a [Applause] second W that's a win [Applause] boom that's what we like to see SC that's a win with a shotgun against other conent creators we love it we love it I love these new player cards that's why I didn't swap out br oh my God bro the teaming is [Music] insane Shield where's he at when we need the most wait where is where's benzo my game my game crashed can you hear me killed one killed one one's on the cash out your game crashed are you able to reconnect it's a 1 V2 Kenny bro how does do that the snapping is insane with these oh I'm dead no you're not I'm dead his buddy respawned next to me he's one shot or the one behind you is one shot here's another one dude and then it's just one hit I uh one of them's one shot deater dude bro getting stuck on stuff is I think oh my God the handing ah all time's crazy getting stuck on stuff frag I can't aim in throwing we left the game H I think that's what happens when people leave like when Oppo left it's cuz his teammate got uh disconnected D connect that revive me bro no okay let how thisy guess I have to come carry killed one pink oh my goodness teaming I have no clue [Music] dude thank you it wouldn't let me demat hey I'm going okay I'm coming I didn't give the scope a good enough chance for what why Always I thought it was just iron sight was going to be the best but the scope actually helps a lot oh my God nice good [Applause] flank RPG on me the frag coming up the stairs or he's thinking about it nice tank on me I killed the one stealing I died for it though that's huge dubs [Music] can't move grenade out he's dead he's dead I think we're going to take [Music] this he's dead we got it boom Duo trios win 13 and five yes Siri am right I'm the carry who you think you're talking to talking to the goat,"The player seems to have a positive opinion of the shotgun weapon in 'The Finals', finding it 'crazy' once they get used to it. They made several successful kills using this weapon. However, they don't mention the pike .556 weapon in their commentary, so we can't extract any opinions or information on that specific weapon from this data.

The player also used the tracking dart operation effectively and enjoyed using it, as they stated that they were doing 'decent chunk damage' to their opponent. They also found it amusing to annoy their opponents with the tracking feature.

Overall, the player seems to enjoy the game and its various features, including the maps and the possibility of streaming their gameplay. However, there were moments of frustration, particularly when they found themselves overwhelmed by opponents or unable to move as they wanted. The text doesn't contain specific feedback or opinions on the Pike .556 weapon in the game 'The Finals'. The user discusses various gameplay experiences, including weapon use, teaming, and player performance, but doesn't provide any insights into the Pike .556. The text provided does not contain any specific opinions or feedback about the weapon balancing or overall opinions on the pike .556 for the game 'The Finals'. Please provide a more specific text which contains explicit information or opinion about the weapon."
The Finals Medium dmr,zN0Gk4RNQrs,The NEW Light Shotgun Is BROKEN In The Finals S4,"Jesus my CPU is at 84 to that I can back out if you want it's up to you I don't want to make you stop I can just back out I don't really want to play another Lobby down yeah some me die first the might hold on I got to watch your ad real quick oh I just got like got like 100ed across the map was he using a sledge I don't know impressive Ste by theam rollers impressive what graphic settings do you play on uh everything on the yeah I have a view distance on Epic that's the dead end oh I opened steam oh no that's another heavy better it's a sledge no what is [Music] that all right I'm back out got win oh I don't have D Pips I forgot to change it I still have four more bullets bro and then I was like wait I'm reloading yeah it's actually weird that you can like feel that yeah there is a noticeable difference oh my God what a bro that was two nades oh but still a triple with a nade yeah how did he know how did he know atelo you're so good probably stream sniping you right now N I bet he's streaming himself worse oh I hav Haven even yeah I haven't gotten the test that yet I hit him damn he's to bar on my body it's a TCO I GED him but it's not doing anything the follow no I got charg and slamms man right behind us teammates just AFK took the kill and then just decided to quit the game oh mine above us that shotgun is [ __ ] ridiculous bro it's crazy it's a t yes it is coming oh you're better barely killed him no it's [ __ ] off leave me alone oh my God you're better up okay all right the building just Falls I'm a f ass I'm dead I got modeled he def the heavy on my body nice just a medium nice no [ __ ] off T oh you cleared his [ __ ] oh yeah he I'm honestly he deserved it oh [ __ ] yeah the AK this is a game changer bro back nice oh my God Tren just [ __ ] on him dude we are frying this game oh my God 57k yeah we're playing really good I love this map man I I just do yeah this map is really nice it's the best parts of like all the maps yep all match together yeah honestly like couldn't have released a better map you know Siege tried do Siege tried to do the same thing and and the map was terrible yeah was it like uh [ __ ] I forgot the name border border and Coastline it was Stadium Bravo yeah yeah Stadium Bravo I got charge and slams do to see only way I die he didn't even mean to kill me either he was fighting someone else I got charg and say I'm telling you it's the only way I die bro I'm telling you no one can like shoot me no he's one damn man all right we still get first yeah barely I wish I didn't get charge and slammed like 15 times though my game just all right dude he's on me he's weak my [ __ ] Game just crashed dog no way come on it's not a potato PC I promise test server type [ __ ] I it crashed my computer earlier so got a [ __ ] 30 him nice did I have 149 in there you might have yeah close enough then and deagle just slammed me yes oh my God what a nade oh he's CED I team wiped him holy [ __ ] bro that's that's the shock I know that's the YouTube clip shock right there this guy in my chat goes [Laughter] GG okay so they have the flashbangs oh I know they do I have HP for that no no no no no RPG oh my God this shit's just Final Round right here no [ __ ] charge and slam bro holy moly I do 264 to him and he hits q and does 130 to me and I just die instantly thoughts you have a PC now yeah whole team pushing us right now damn bro I'm not used to this evasive Dash I almost killed him too P they did not Gateway the Box really wow and it disappeared right after I took it unlucky dud over I just three shoted a heavy I dashed into a mine dude deep there's one hiding under the rubble that's really weak he's probably heed by now oh my God should have died there if that guy was like good think on me got to get used to this bro where the Jag at first Flor how did that not damage him Gateway way above it we can just use it to come back they're on a oh my God n and0 bro holy [ __ ] shotgun is fire uh why did I like have no momentum there what my momentum like canceled midair I have a plan light sniper or light DMR I think what the hell is a light DMR L1 oh [ __ ] not doing any damage to me but I see the glint so just in there [ __ ] oh oh oh oh oh that's actually a DMR yeah it is I got a kill boys behind you get right in front of you I hear more on the roof here kill him get him good job guys you don't even have to aim in with the shotguns no but I I do only cuz it just makes it easier for me to hit the shot really yeah I don't know why but myair on it if I like quick scope it [Music] I I have to like quick scope I'm awful when it comes to quick scoping only good at it in BO2 oh hold on hold on hold on hold on yeah yeah yeah oh yeah I hit him with both those nades there I right somewhere on me he's like in the bushes good [Applause] job some of the inspects look really good for thumbnails too oh yeah oh my God how many times am I going to whiff right there thank you yeah they were both low I'm just like missing all my shots yeah we were both there just like not hitting anything it's crazy look through your scope some more buddy got kill him faster than that I killed one SC on the AK is NY right here oh that nade was beautiful who's running flashbangs I cannot hit him up close holy where they at oh one's across I just missed myage bomb bro I might double n him here yeah I hit him once [Applause] second floor of this building first floor no we didn't get him damn it that was one kill short that was a good game though oh we're playing water dance are they on you oh wow yeah oh buddy I just got double team bro you're [ __ ] nasty thank you thank you no no I should have just let it reload and I would have killed him H uh I'm on theame I'm playing the final season 4 early but I'm getting off after this game no I might get on deadlock soon but I need to eat first at least I didn't one pizza yeah that's what I'm about to eat I haven't had anything else I'm dead I don't even know what happened I got uh winched into a charging slam no I got to reload [ __ ] I'll kill him here I'll kill him here no no no no I should have known it's going to go back down when I do that Fu I'm coming back I want to take you should let me know if you uh all right I I'll let you know nice kill I'm trying to get this Steel come on no way [ __ ] you water dance why the [ __ ] did it make me slam God damn it oh [ __ ] no no no no damn oh my God they wouldn't even have known I was there if I just jumped up [ __ ] my Vault up can you say deadlock yeah Charing SL I'm dead damn bro damn it how did the two two player team get first yeah that's crazy really yeah like that's annoying as [ __ ] oh we're against a Telco that's cool that uh one of my friends he's one of he's like a top player high on the leader boards name um he's an EU player oh okay you ever compete in any of the community tournaments I play KR scrims but I never played any like tournaments or anything no you should do it next time it's pretty fun yeah well I was well I was I was going to with uh list listy uh one of my friends and he like invited me and he was getting a [ __ ] ton of hate for it like everyone was calling me a [ __ ] so and then he ended up having to find other people because of itam PR holy aneurism flashbang come on py Kid K one oh charging slam that don't mind I killed by white pink oh he's nice shot I'm going to kill this guy elbows in in like in like in like 5,000 FPS too like that's crazy yeah ah he's weak he's weak over me you're going to get one shotted oh he's not there anymore he want jumped to the roof this thing is insane dude [Music] what get the Jag St have grapp my going in wow they're on the roof above they're on the roof above nice good job both teams are wiped oh my where'd he go front of me I ran out of ammo Bro [ __ ] so lucky the shotgun feels really good it does him no dual deagles on me dual deagles oh my God they're right above you Krampus whoa that kid one shot oh all right ran towards him not that guy no that gun is kind of crazy that gun is insane what is this guy doing I'm just going one glitched one needed one killed one light's slow light slow it's a medium no it is a light last low zip to you zip to you he probably regen nice I didn't even hear him yeah the reload on the shotgun is so fast I fell nice good job I hear them bye bye oh he's one shot bye this thing is crazy bro this is insane they left I was the other team that was P oh yeah right so the shotgun might be the best new weapon they they added this is insane all right one of them left I'm leaving look look at the look at these [ __ ] dual builds that's your this is your reload this is the reload animation right here that's a Reload that's an empty reload look at this reload animation like are you [ __ ] kidding me this is a Reload animation bro here's the inspect actually crazy here's here's the other inspect like bro what imagine for a thumbnail like imagine this for a thumbnail it's going to be insane now look at R six animations yeah they're dog [ __ ] look at this [ __ ] the St even the standard even the standard reload is [ __ ] cool this this is the standard reload that's [ __ ] sick what the [ __ ] that's a standard reload this is the special reload crazy you should see them ads too the ads looks really cool","The text provided does not contain specific opinions or details about the pike .556 weapon in the game 'The Finals'. It is a conversation between players discussing various aspects of the game, but none are focused on the pike .556. For a detailed analysis, please provide a text that specifically discusses the pike .556 and its balancing in the game. The text provided does not provide specific opinions or feedback on the pike .556 weapon in the game 'The Finals'. It mostly discusses players' experiences with different game situations and interactions, but there's no direct reference or details about the pike .556 weapon. Therefore, it is not possible to extract the player's opinion on this weapon from the given text. The text provided doesn't seem to contain any specific opinions or reviews on the pike .556 weapon for the game 'The Finals'. It mainly consists of gameplay commentary and some unrelated discussion. Please provide a more focused review or opinion on the weapon for better analysis. The player seems to have mixed feelings about the Pike .556. There is a sense of frustration with reloading and the player seems displeased with the weapon's slam feature. They also mention running out of ammo, suggesting that the ammo capacity may be an issue. However, they also compliment the weapon by calling it ""insane,"" suggesting it has high power or effectiveness in certain situations. The player also suggests that the weapon can be unpredictable or difficult to control at times, which adds to the challenge and thrill of the game. There is no clear consensus on whether the Pike .556 is balanced or not, but the player seems to enjoy using it overall despite some issues. From the given text, the opinions about the pike .556 weapon in 'The Finals' game are generally positive. The speaker describes the weapon as ""crazy"" and ""insane"", which in the context of gaming language can be interpreted as very effective or strong. The speaker also suggests that it might be the best new weapon added to the game. 

There are some specific points made about the weapon's reload animations. The speaker is very impressed with them, describing them as cool and even suggesting they would make for a good thumbnail, indicating they are visually appealing. The speaker does not seem to have any issues with the balancing of the pike .556, suggesting it is a well-balanced weapon.

Overall, the opinion on the pike .556 is very positive, with the weapon being described as one of the best additions to the game and its animations being praised. However, without more context or specifics, it's hard to assess other aspects like its damage or rate of fire."
The Finals Medium dmr,7VZ1PcoOLgk,THE FINALS Season 4: AKM With Scope is INSANE!,the whole time all right trying out the akm all right let's try this out he has a akm wait did it there has a scope on it we're good I don't know where all the Skins got that guy has a skin I don't now the high notes the ultra rares and finally the Steamrollers watch closely folks they're [Applause] ready oh this is a new map who knows what's going corn in wo wo wo W oh my God end the scope as well okay this looks like an apex map lowkey wow a knock at the door Vault one from the ult a recall hits a bit hard all you never miss aot why you're the expert oh my God the first team landed let's see how that affect things in this round this is this genuinely looks like an apex map but this is some low stuff then right like this is like a old this is like an old finals map like the one is Scotty one on oh wow yeah the all right can fly around it's a bit I want to say it's a bit smaller wait this is just Soul wait I mean basically this looks like bar for bar the steam rollers Are Back In Action over here it looks cool though I like it the Steamrollers grabbed a cash box go in for a steel on a now don't oh is he holding it can you can you hold the right click now knife buff adversity for the high notes wipe out I would have expected them to survive [Music] [Applause] keep your on theam rollers what a steal hold FR up right C too that's pretty cool the zipline I would have loved to be at the twitch con for this but it's expensive to go man go travel all the way to the US it's like thousands of dollar dudes set a zip the high swooped up a cash oh we good of AC instruction aits as we enter the second half of the match these teams are buying for the favor of our sponsors and they are certainly giving it their best out there [Applause] okay we're getting into it Ultra rares have collected another unfortunate team WIP if they want to win that be something of a [Applause] rarity okay I thought he would like try to backstab me or something not just jump straight in my face he's dead though the ultra RAR are back and ready to avenge that team there's a lot of crossover from this map and so I said it was bar for bar which is obviously not true but it's definitely a lot of crossover ping up is this [ __ ] London what's up with all the knives the ultra rares will have to polish their strategy from the sidelines team WIP there as common as a fourleaf clover in the arena now June you're timing that's a thumbnail though that this is a video I don't know if he can just upload this on his own don't know how long the game is but the Steamrollers are busy fing into a vault the steam rollers grab a cashx oh [ __ ] material it's over time one final opportunity for our teams to climb the lead aboard the Steamrollers are initiating a not click but need to add the cat girl right out from Phantom Forces on [Applause] it the ultra that is such a good [ __ ] clickbait I'm going I might steal that one day I'm not going to remember deploying a zipline go ready I it it feels like three teams is too small for this map right it feels wrong I don't I wonder if cash out supposed to be free teams this is also the cash all cash out so maybe like for ranked it's actually wiped out again they've gone from Symphony to cacophony oh you've been practicing haven't you that one's got flare Line Station deploying drad we just entered the last 30 seconds of the match let's see who can rise to the occasion the high notes grabbed a cash box 10 seconds left [Applause] hello well the Steamrollers certainly cranked out of damn congratulations to our Rising Stars they you SE in World Crosser setting if you turn off your Crosshair doesn't move the Crosshair like the I like the new map though like you said,"The provided text does not offer any specific opinions or details about the weapon balancing or overall performance of the Pike .556 in the game 'The Finals'. The discussion mainly revolves around the gameplay, the map, and the actions of different teams in the game. The player is trying out different weapons like the akm and discussing the game's features such as the scope, skins, and the new map. However, there's no mention of the Pike .556 or any evaluation of its performance or balance in the game. From the information given, there are no specific detailed opinions about weapon balancing or the pike .556 for the game 'The Finals'. The information provided seems to be more about gameplay, strategies, and map details rather than specific weapons or weapon balancing."
