Query,Video ID,Title,Transcript,Opinions
The Finals Medium Class guide,81CpaQSUMG8,How to Win More with Medium Class – The Finals Pro Tips,medium is the most used Class in the finals right now I think and after close to 650 hours in the game I want to share the things I've learned Ming medium and high level lobbies but before you jump in the arena make sure you know what you're up against one of the things I like to do is check the leaderboard before getting into the game this way I know which classes I'm up against and I can choose my counter weapons and gadgets if I see a lot of lights in my Lobby for example I'll choose between the F card the revolver or the model 1887 because I counter best lights with those weapons one of the most interesting things I found about this game is how Embark managed to make the medium a support class while also acting as an assault class you can do just as much damage if not more than a heavy or light while still supporting your team more than they can this brings me to the heal beam I've seen a lot less medium players use the heal beam after their season 4 Nerf but it's still an extremely powerful tool for the medium class I'm sure we've all been against a three medium heal beam circle jerk before I'm back circle jerk circle jerk circle jerk circle jerk circle jerk but remember you don't always have to be aggressive as medium you can hang back with the heal beam and watch the show I'm healing you bro I'm healing you bro I'm healing you bro it's all you bro nice another thing you can do with the heal beam is the body block heal Strat that I'm sure you've all encountered before which is also really good for the last second steals but hey if you're not a heal beam guy that's okay with me you have to find the best specializations and gadgets that fit your play style I personally like to stay alive as long as I can so I've been using a lot of things to keep me alive like the goo grenade and dematerializer as of recent Staying Alive while dealing damage to your opponents helps your team a lot because even if you can't finish someone off on your own your team is there to help you and if one of your teammates go down you can defib someone and keep them alive speaking of staying alive make sure you're using your movement and gadgets to outplay your opponents this is especially useful when fighting in buildings cuz the enemies never expect a window jump when I'm being chased utilize your gadgets use Goo or grenades or flashbangs whatever you need to help stay alive this kind of goes for every class but let's say you aren't running the right gadgets or you ran out well using the canisters around the map is extremely underrated I've gotten out of so many situations where I should have died but a trusty goo canister or red canister was there to save my life when I should have very easily died for all you AR users make sure you learn The Recoil pattern of your gun with that said I don't even fully know the recoil pattern of every gun I have the memory of a goldfish but I do remember the F car pattern because all the bullets do is go up to the right slightly this one was very easy to learn for me and with the season 4 update allowing me to remove the scope the F car has become a lot more satisfying to use so before jumping into a game check out the patterns in the practice range or do what I do and just shoot a wall when you join a game for a quick reminder of The Recoil pattern remember that Medium is a support class so if you're the type of player that likes defending cash outs then don't be sleeping on the mines sometimes you can get away with some pretty ridiculous things a man uh on that the will have to oh my God oh my oh my no [ __ ] way dude that's wild that is insane the glitch mine is still very powerful despite its season 4 Nerf you only get one but you can place two on the map once it's done charging up throwing a glitch mine on a statue is a great counter to other mediums and it's one of the most frustrating things they can encounter going for a defib on your teammate and being glitched and switched to your primary weapon is not a good time team coordination is huge in this game and I I get it solo cubing is tough but try to find someone you played well with and AD them having your team all push someone is easily one of the best ways to win and having coordination and trying out different things may surprise not just your team but you as well you're going to jump head up break through the window and place two turrets all right okay here hold on hold on wa wait so I'm going to place this jump Pad Place the turrets then we're going to go around over that side and you're going to jump P okay yeah yeah all right okay let's go turret jump drop all right now come back there I a jump pad right here moving follow go flank oh my God please oh my God oh my God what the [ __ ] dude so there you have it that's how you use medium get creative use your movement and support skills to your advantage keep your team alive and have some fun if you enjoyed the video consider leaving a like And subscribe for more finals content also leave a comment below if you found some tips and tricks you want to share while using the medium class that's all I got for today thanks for watching and I'll see you next time,"The user has spent a considerable amount of time in the game 'The Finals' and has shared some insights after playing for close to 650 hours. They primarily focus on the Medium class, which they find to be a versatile choice that can fulfill both support and assault roles effectively. They appreciate the game developers, Embark's efforts to balance this class. 

As for the weapons, they strategically choose counter weapons based on the classes they are up against. They did not specifically mention the CL-40 grenade launcher in their commentary. 

They have noticed a decline in the use of the heal beam, a tool for the Medium class, following a nerf in Season 4. However, they still believe it to be a powerful tool when used correctly. They advise adopting a more passive approach when using the heal beam, suggesting it's more suitable for a support role than an aggressive one. 

The user has highlighted the importance of finding the right specializations and gadgets that fit each player's style. For them, staying alive is a priority, so they prefer using tools like the goo grenade and dematerializer which help them survive longer. They stress that contributing to the team's success is not just about eliminating opponents but also about assisting teammates. 

In conclusion, the user's opinion of the game 'The Finals' is generally positive, appreciating the balance and versatility of the Medium class and the strategic use of weapons and gadgets. However, they have not provided a specific comment on the CL- The sentiment towards the CL-40 grenade launcher in the game 'The Finals' is not specifically mentioned in the given text. However, several other aspects of the game are discussed.

The user emphasizes the importance of utilizing movements and gadgets to outplay opponents, especially in indoor fights. Gadgets like Goo, grenades, and flashbangs are highlighted for their utility in staying alive, suggesting that they are well-balanced and useful in gameplay.

The usage of canisters around the map is underscored as being underrated and helpful in tricky situations, pointing to an aspect of the game that the user thinks gamers should pay more attention to.

The importance of learning the recoil pattern of guns, especially the F car, is mentioned and appreciated, particularly after the season 4 update that allowed the removal of the scope. This shows the user's approval of the game's weapon mechanics and the update's improvements.

The Medium class is referred to as a support class, suggesting a favorable opinion of its role in the game. The user also recommends using mines for defending cash outs, indicating that they find this aspect of the class effective.

While the Glitch mine was nerfed in season 4, the user still finds it very powerful and particularly effective against other Medium class players. This reflects the user's approval of the balancing changes made in the game's updates.

In general, the user seems to enjoy the tactical aspects of the game and the potential for using gadgets and game mechanics to outmaneuver opponents, The provided text doesn't contain any specific opinions or data about the CL-40 grenade launcher weapon or its balancing in the game 'The Finals'. It rather discusses the importance of team coordination and strategy, and mentions the use of medium class, turrets, and jump pads. For accurate analysis, please provide relevant details or text about the CL-40 grenade launcher."
The Finals Medium Class guide,PaSJNoNkh60,How to be the Medium Player that your teammates will love,so you want to play the medium class maybe it's because you saw how some of the top players play medium and decided that you want to take your gameplay to that level or maybe you've gotten addicted to the movement that the zip line and the jump pad provide you or maybe you just saw the AK-47 and decided yep yep this is this is the class it's been decided whatever the case may be you've come to the right place with this video I'll be giving you all the information that you need so that you can stop your gaml from looking like this here let me get this defib off real quick jump pad there's a guy turret out you're done for it buddy there's two what the what that there's two of them that's not that's not fair as a medium you are playing one of the most versatile classes in the game you're good on attack defense and support but with these advantages comes a large skill Gap that you need to be aware of when you pick this character so to help you climb that skill Gap I'm going to be providing a bunch of tips for every medium specialization throughout this video as well as tips for medium class as a whole and with all that being said let's get started so the very first thing that I'm going to do here is put down this jump pad for my team right here which allows me and in particular my heavy teammate to get very aggressive with the Enemy team I noticed that my Heavy's health bar is getting kind of low and at this time I take a ton of damage so I reposition and heal my heavy so he can take the fight instead I'm also going to do a quick defp on the heavy teammate which is just going to give us a lot more certainty in being able to close out this fight but something that I've noticed is that there there are a lot of people who use defibs at really bad times so I'm going to quickly explain when you should defib and when you should not this is when it's okay to defib if you can gain numbers advantage on the enemy team or at least equal out your team numbers to stall a cash out and divert attention in emergencies and to quickly reset if you expect a third party but there are many times when you should not defib some of these are if someone is already resing if you are unlikely to win the fight even with the defib an instance of this would be if you are in a 1v3 and everybody is at half or more Health if you have to die for the res in some cases this one is okay but 95% of the time dying to get a defib off is a really bad idea and if you are in no danger and you can save it for later treat your defib like a valuable commodity do not waste it so now that I've discussed when you should and shouldn't defib let's go back to the gameplay examples after we've secured this cashbox it's time to put our movement to use again taking height is very important in this game because if you don't have someone else will and medium's utility lets you get that height Advantage very fast I heard some enemy footsteps so I decided to Ping wildly to let my team no to group up if you are playing solo queue and something important like this is happening please use your ping Button as it can really be the difference between you winning that fight and you losing that [Applause] fight one contestant doesn't seem now some of you may have noticed that we are leaving this cash out before it's completed we are doing this because this cash out is honestly almost done and it's highly unlikely that a team steals during this time and before this I had checked the scoreboard and I had seen that all of the teams were actually doing damage which means that they are all fighting over the cash out more than likely however this is where I almost make a crucial mistake not playing with my team it's important to play buyer team when you are a medium or a heavy but especially as a heal beam when I realize my mistake I immediately go to regroup with my heavy who can hopefully protect me my heavy decided to dome shield in and go for the cash out but instead of healing him the whole time like a lot of mediums would I Instead try to kill the people shooting at him there's a time into place for healing but if you can outright kill an opponent it's better to do that instead of just healing King them and hoping that they survive after I deposited this cash out I noticed that D already has a fair bit of progress on it and it's close by that means there's the potential for us to be able to take both cash outs and if we could pull that off that would be a huge Advantage but before I push in I try to get some opening damage from long range and wait for my heavy to push in ahead of me when you're the healbe medum you want to try to be the Last One Alive as often as possible as he takes the cash out I'm going to watch to make sure that nobody tries to kill him while he takes it once again this medium shows up near the end of the Steal but because the cash out is nearly stolen I go to heal instead of kill after I whiff some really easy shots here I go to defib the heavy in case of a third party now here is a very important decision making moment when I go over to push up on this cash box I notice that the timer is nearly up and both of my teammates are busy fighting so if we want to take this box I have to act now luckily my teammates were able to body block for me and we were able to take it so while you as a heal beam medium probably shouldn't be the one taking the cash box in certain Niche scenarios like this you just might have to do it anyways also if this video has been helpful consider leaving it a like as it really does help me out a ton and if you like the sound of mostly weekly finals videos consider subscribing it's okay I can wait okay I'm done now let's get back to the video in this game I'm in a triple medium team and I'm playing with dematerializer with dmat you can afford to play a little bit more aggressively and a little bit more like a light player because you don't have to worry about healing your teammates so I'm going to be pretty front and center in a lot of these fights I see that the heavy has put up a barricade and is playing behind it so I decide to pressure him with the dmat my teammate manages to take down the heavy but then goes down but instead of getting the defibr I leave that to the other more support focused medium in my team and try to go and finish off the light once again I'm going to give my team a little bit of movement so we can deposit the cash box faster and then we're going to to take height it's actually a much better idea to not hold the cash boox on the moving platform but instead to follow it around from High Ground if you get this specific event instead of chasing this team across and trying to kill them we are going to take this zip line all the way to the top of Apartments where we will be able to hold a much better position and can use our movement gadgets to quickly rotate to the platform if necessary if this team doesn't want to get jump padded on top of they're going to have to challenge us while we have the positioning Advantage at this point I go into get aggressive with my dmat and get their attention and some opening damage but then I rotate out with my jump pad and let my teammates clean up after we finish this fight we're going to use the zipline to once again rotate over to the next building and be ready for another fight if necessary and sure enough pink team is going for the Cash Out station so I decide to drop down and keep them from stealing the cash out even if it means that I end up dying I managed to stop them from stealing with my aggressive play and while they are focused on dealing with me my teammates are able to get some pretty free damage on so this next engagement is a really good example of how you should play dmat around cash out a lot of dmat players would like to drop the cash out immediately upon depositing the cash box but this isn't a great idea here I'm going to hold the high ground with the rest of my team to try and stop the enemy before they even reach the cash out here by playing below the cash out instead of above it I can drop it down and stall for longer and possibly isolate A3 V1 if I also manage to get one of the opponents then me and my team are going to rotate to the floor below again to do the exact same thing here pink team finds us and takes a fight but because we aren't playing in the room with the cash boox we are limiting our chances of being attacked by a third party after I whiff some of my shots I go and defit my teammate instead of slow resing because I hear footsteps and I expect that I will need to drop the cash out immediately some other ways that you can use the dmat is by playing very aggressively with it and cutting off opponents who might be running away from you [Music] at the time of recording this video turret is easily the worst specialization you can use for medium unless you play terminal attack however if you still want to use it I do have a few tips for you on how you can maximize your turret efficiency be careful about some of the materials that you place your turrets on for instance these ceilings on Soul tend to break really e easily and if your turret falls down from them it's pretty much useless a lot of players expect you to place your turrets near the cash out but if you do this too much it can become predictable and your turrets lose a lot of their value FX it up once in a while by placing it in an area away from the cash out where you can either fall back to or play from to catch the Enemy by surprise another example of good turret placement is this clip right here where I placed it in a space that will cover either staircase from the enemy that they could push up from Once the turret does some opening damage I Engage The Enemy while they are distracted to get a quick kill I also tend to notice a lot of turret medium players like to sit by their turret at all times you don't need to do this and this actually limits you a lot don't be afraid to push enemies and then when they chase you go run back to where your turret is placed to make them really choose between whether they want to keep pushing you or if they want to back up and not deal with that turret something else that I do to mix things up as well is placing my turret in one area for the first fight at a cash out and then moving it after that fight is finished to be much closer to the cash out this usually really catches my opponents off guard and can be a great way to mix up your strategy but besides these tips just play turret medium in a similar way to the dematerialize your medium and you should be fine and those are a bunch of ways that you can be a better medium player now all of these things can be quite a lot to take in so if you feel overwhelmed by all this information just try focusing on one thing at a time until you've mastered that and then move on to the next thing I really hope that this video was helpful and entertaining and if it was consider giving it a like as it really does help out the channel and consider subscribing for mostly weekly videos on the finals and with that I'll see you in the next one [Music],"The text doesn't provide specific opinions about the CL-40 grenade launcher or weapon balancing in the game 'The Finals'. The player discusses strategies for the medium class, mentioning the use of the jump pad, the AK-47, and the defibrillator. The player also discusses the versatile role of the medium class in attack, defense, and support, but there is no specific mention or opinion on the CL-40 grenade launcher or weapon balancing. The text doesn't provide any specific opinions or details about the CL-40 grenade launcher in the game 'The Finals'. It primarily discusses strategies in the game, focusing on defibrillation, movement, teamwork, and the importance of height advantage, but doesn't mention the CL-40 grenade launcher. The text does not provide direct comments or opinions about the CL-40 grenade launcher or weapon balancing in 'The Finals'. The player discusses strategies and scenarios in the game, such as prioritizing killing opponents over healing and making tactical decisions during the gameplay, but they do not mention the CL-40 grenade launcher or express any views on the balancing of weapons in the game. Without specific references or comments, no analysis can be made about the CL-40 grenade launcher or weapon balancing. The text provided doesn't give a detailed opinion on the CL-40 grenade launcher for the game 'The Finals'. The player seems to be discussing their tactics and strategies during gameplay, focusing more on movements, positioning, and team coordination, rather than weapons, specifically the CL-40 grenade launcher. The text provided doesn't contain specific information or opinions about the CL-40 grenade launcher weapon in 'The Finals' game. However, it does give insights on strategies involving cash out, dmat, turret specialization, and some tips on gameplay like playing aggressively, playing below the cash out, careful turret placement, and not being predictable with the turrets. The user mentions that the turret is the worst specialization for medium, unless playing terminal attack. They also advise against constantly sitting by the turret as it limits the player. The text does not provide any specific opinions on the CL-40 grenade launcher, nor does it discuss weapon balancing in 'The Finals'. The user mainly discusses strategies for using the turret in the medium class, such as placing it strategically during fights. They suggest continuously changing the turret's location to catch opponents off guard. They also advise new players to focus on mastering one aspect of the game at a time due to the potential overwhelming amount of information. They encourage viewers to like and subscribe to their channel for more content on 'The Finals'."
