Query,Video ID,Title,Transcript,Opinions
The Finals best weapons season 3,gPg32VDwju8,I Used &amp; Ranked EVERY THE FINALS Weapon (Season 3 Tier List),how's it going folks the weapons in the finals have gone through some serious changes since my last tier list and since we haven't received any more balance changes in the most recent patch I think it's about time to remake a new list of the best and worst weapons in the [Music] finals and Now ladies and gentlemen may I present to you our most dangerous contestant in the arena L homo all right folks I'll rank each weapon purely on its strength in the current state of the game not on how fun they are to use or my personal preference if that were the case the list would probably be completely reversed okay so without any more hesitation let's get into it starting out with s tier I'm also labeling this tier as instant Advantage meaning that in my opinion if you pick these weapons you're straight up in a better position than you would have been using the weapons in the tiers below starting with the F car nothing's new with this one folks as far as I can remember the F car has always been the best gun in the game and it still is is with a very low skill barrier other than getting used to the recoil the F car lets you use a stupidly strong weapon that is probably better than most of Lights weapons all while getting to play as a medium with an extra 150 HP there isn't a whole lot more to it I think there are other weapons that are better than the fcar but it's the fact that the medium build gets to have such a strong weapon that puts it at the top of the list now folks if I made this list at the start of season 3 then the L H1 would definitely be at number one but since they reverted the damage buff it's kind of found its place the visual recoil buff is still crazy though and that's why I'm picking it as the second best weapon in the game it has equal damage at all ranges the only downside to it is that you will have to be more static when you're aiming with it because the bloom When jumping or strafing is very random and just to follow it up the M11 and xp54 these SMGs are always going to be ridiculous in the right hands I think the M11 is the better weapon although it does require a completely different play style compared to the XP if you can adapt the close range In-N-Out play style that the double barrel Mains use then the M11 is clear 40 rounds shreds Health great hip fire and jump accuracy and it has a quicker reload to the XP these are the reasons why I prefer it as an SMG now saying that the XP is still an amazing weapon and I'm still putting it in s tier it gives you a much larger range than most of light's other weapons and it has a ridiculous headshot multiplier the sights and recoil require only very basic skill the XP is definitely one of the easiest weapons to use in the game and if it wasn't for the slow reload time and the inaccurate hipfire accuracy then it would easily be the best light weapon all right moving on to a tier I'm calling this tier great but not OP starting out with the model 1887 the model at its core stands in a play where it could be considered a top three weapon it has great range doesn't require aiming down sights very strong damage and a quick enough fire rate but it has a seriously tough fatal flaw the model's reload animation has what I would consider to be some sort of bug but since it's been in the game for so long I guess it's intended the problem is that sometimes when reloading this gun it won't allow you to shoot to cancel the animation now what's strange about it is that sometimes you can shoot but then other times you have to wait for the full animation to bring the gun back to six rounds for that reason alone I'm putting it at the top of a tier but not quite s tier the AK fits in perfectly as an a tier weapon it hits relatively hard at all ranges has nearly too much ammo a decent headshot multiplier and is generally just known to be an allrounder weapon it's boring but does the job and it's great for team play such as breaking Shields and equipment I don't compare it to the F car because it isn't as strong especially if you have decent aim the F car always lands on top but if you're looking for something a little more forgiving then the AK is perfect finishing off a tier we have the M60 in my last list the Lewis gun was ahead as the best heavy weapon but since the recoil change in season 3 I had to say that the M60 is just better 70 rounds crazy headshot damage and it's kind of odd to say but its recoil really isn't that much worse than the Lewis guns right now uh the heavy weapons aren't really on the same level as medium or lights but then then again you have to factor in that you get so much extra Health with the heavy build and for that reason the M60 is making its way into a tier on this list now we move on to B tier to sum this tier up these are weapons that have really high capabilities but will be limited by the amount of skill it would require to be consistent with them starting out with the sniper obviously the sniper has some of the highest damage potential in the game and so that's what is putting it so high in this tier I think the sniper use case has grown a lot in season 3 especially if you play ranked terminal attack another thing about the sniper is that people really do underestimate how effective it can be with an aggressive play style I love using grapple sniper but not in a hard scope camping like a [ __ ] kind of way the silenced pistol practically just as strong if not stronger than both SMGs but it just requires way too much effort to even match what they can do it's amazing don't get me wrong but having to single fire and maintain good aim with a weird sights just puts it as an exhaustive way to match the xp's effectiveness the Lewis gun was once considered without a doubt the go-to heavy weapon but the recent recoil change has really messed up this weapon's effective range in my opinion still does a job in close range but once you even get to that mid-range area I find that maintaining accuracy no matter how good your aim is is going to be very tedious and especially when you consider that it holds half the ammo Mo as the M60 you won't be given the same wiggle room to spray and prey in situations that require it the recurve bow I love it such a breath of fresh air weapon now I do have to switch over to mouse and keyboard to use it but that just highlights the type of weapon it is I don't think it's better than the sniper but it is very strong and if you can get the timing down with it it can be really fun to pair with Dash and Gateway I think this tier is perfect for its use case and skill requirement I have always ranked the throwing knives is one of the worst weapons in the finals and I stand by it that until the buff these things were just a joke weapon but since the buff and even after the recent damage Nerf I think the projectile speed and accuracy change has turned the knives into a very viable option for lights style points head shot beams and no reload makes the knives so much fun to use and in terms of criticism the only major flaw is their range which is very small making them an easy counter for players who've copped onto the knives play style the double barrel change is an odd one for me obviously the damage buff is amazing being able to twoot Heavies and not having to awkwardly dance around them while waiting to reload but we also see a much larger spread now in slower fire rate meaning that you have to basically be inside the enemy to kill them I think this tier is ideal for this weapon in the right hands and with great movement it's going to be super annoying to play against but then again the the counter is so simple that I just can't put it any higher C tier weapons these are all solid but really wouldn't reach much higher on the list due to their potential for me starting with the flamethrower good damage intimidating Pest Control you wouldn't even need hands to aim with this thing but it's super situational I love the flamethrower but one stun gun or enemy on high ground and it's over the slug shot gun very underrated other than the weird aiming perspective and the pet travel time I think the slug is a great pick for Heavies 100 plus damage at long range and a good fire rate make this thing really nice to pair up with heav tech perfect for cleaning up fights or third partying the FAS it received another buff but I'm still not able to get with it the gun can be effective but it feels so limited in situations where I'm trying to wrap a fight up quickly I almost always feel like the FAS is just one or two shots shy of finishing a kill and even though it has basically zero recoil it just isn't strong enough to compete with the other ARS for me once you get past the sights and Bloom with movement then the revolver turns out to be a really hard-hitting weapon it does require Landing head shot to be effective at range but unfortunately even with amazing accuracy I find the damage drop off to be way too short for the revolver I do think it's due a range buff at this stage of the game especially when you consider how few people actually pick this gun I love it though to be honest and I think it is a solid weapon the dagger is also a solid weapon the backstab can one shot every build in the game even Heavies if you add an instant quick melee obviously that statement makes it sound op but the fact is that it requires the same play style as the double barrel plus the ability to always land hits in the back because if you don't land the stab in the enemy's back then you'd be better off trying to emote in front of them hoping for Mercy I'm putting the sword right next to the dagger I know some people would have it the other way around but the thing is without animation cancelling and with the removal of the multi-hit function the sword is at the worst point it's ever been now I do think it's strong in quick play modes banket and power shift especially but other than that the sword's capacity is limited by its range and it's similar to the flamethrower in a situational sense just with less than half the health on your side still a solid weapon on this list by the way the sa 1216 just like in my previous list I think it's the most overrated heavy weapon this gun's rhythm is too awkward like that weird Jazz from the movie Whiplash except in the end you don't Master it but you realize that you won't be one of the greats because Jazz is mid and scraping its way into C tier is the sledgehammer much more useful now with the hook ability the sledgehammer is a super strong weapon and is amazing for defending cash outs unfortunately it's also been affected by the removal of multi- hit so you can no longer hit those three pieces in one shot realistically though it's just in the same boat as the other melee weapons too easy to counter but great nonetheless now we're into D tier folks I could have put these weapons in CTI here but I just felt that they deserve to be separated from those above it the dual blades I want to love these they are quite strong and the deflect is a nice feature but I do think that they're meant to be used more aggressively than the riot shield and medium just doesn't have the mobility for that play style I also wish they buff the time it takes to switch from attacking to deflecting because it's too slow for close-range combat the cl40 I may not be a fan of this weapon but man the recent Nerf has actually [ __ ] it the splash damage is like blowing farts at the enemy and I do feel bad for the players that M it because it must be really frustrating to have to use more ammo than you have to begin with in order to finish a kill and folks the spear yeah I mean it's decent but the hammer is better for me the extra range is a nice bonus and the alt fire is great for power shift plays but I mean come on it's a quickplay weapon and that's fine but it won't be making its way up the list for me anytime soon finally our e tier weapons if you use these you enjoy the little things in life like looking at nature and playing with crayons and coloring books the burst pistol when I read the patch notes for season 3 it looked like they buffed it oh man I was wrong it's actually just a disadvantage to use it damage and range is too low and the mag size is just sad best of luck to anyone who's willing to give it some love the heavy grenade launcher I'm promoting it from the worst weapon in the game to the second worst congratulations to anyone who mans this gun you're making your way up bro it is possible to have some success with this weapon but at what cost I mean sure if you give it plenty of hours and get the angles down then you'll start seeing enemies Health drop bit by bit but then again when I come against a heavy and see that they're using this thing it's a nice little moment of relief last and also least the riot shield [ __ ] me I love this thing I mean it's the most frustrating weapon to play with and play against it sucks ass but I find it to be so bad that I actually can have fun using it chasing after lights who can simply just run in a straight line for eternity without any consequences is so satisfying when I'm trying to get myself ready to sleep I also find it very soothing and therapeutic to close my eyes and have a nap between the melee animation by the the time I wake up I'm just about getting to the second hit and the game's just about over folks that has been my weapons tier list for season 3 of the finals I love nothing more than hearing all your thoughts and opinions so be sure to let me know what you'd have done differently in the comment section if you have any questions I'll do my best to respond ratings and follows are greatly appreciated thanks very much for watching bye-bye now,"The user's opinion on the weapon balancing in 'The Finals' is that it has undergone significant changes since the last tier list, and no additional balance changes have been implemented in the recent patch. The user believes it's time to remake a new tier list of the best and worst weapons in the game.

Regarding the CL-40 grenade launcher, the user does not specifically mention this weapon in their discussion. They focus on the F car, which they consider to be the best gun in the game due to its low skill barrier and powerful capabilities. The user also mentions the L H1, which would have been their top pick at the start of season 3, however, since the damage buff was reverted, it's now in second place. The user concludes by mentioning the M11 and xp54 SMGs as other weapons of note.

To get detailed opinions about the CL-40 grenade launcher, more specific feedback or comments about that particular weapon would be needed. The analysis does not provide specific opinions or data about the CL-40 grenade launcher in the game 'The Finals'. The text discusses other weapons like M11, XP, Model 1887, and AK, but not the CL-40. Further information would be required to provide detailed opinions on weapon balancing and overall opinions on the CL-40 grenade launcher. The review does not provide any specific opinion on the CL-40 grenade launcher from the game 'The Finals'. The user discussed other weapons such as the F car, AK, M60, Lewis gun, sniper, and the silenced pistol but did not mention the CL-40 grenade launcher. The user feels that the CL-40 grenade launcher in 'The Finals' has some balance issues, particularly due to its limited ammo capacity. They compare it unfavorably to the M60, stating that the M60 allows for more flexibility in play style, especially in situations that require 'spray and pray' tactics. 

They also express a liking for the recurve bow, praising it as a 'breath of fresh air' and noting that it has a high skill requirement, which they appreciate. They do not think it surpasses the sniper, but they find it to be strong and enjoyable to use in conjunction with the Dash and Gateway abilities. 

Their opinion of the throwing knives has improved significantly since their buff, stating that the increased speed and accuracy have made them a much more viable weapon choice. However, they criticize the knives for their limited range, which they believe makes them easy to counter.

As for the double-barrel change, they find it to be a questionable adjustment. They appreciate the damage increase but have issues with the wider spread and slower fire rate, which forces players to be in close proximity to their targets for effective use. 

Lastly, they mention the flamethrower, which they like for its damage output and intimidating factor, but they note that it's highly situational. They imply that the flamethrower can be easily countered, particularly by a stun gun or an enemy on high ground. The provided text does not contain any specific opinions or information about the CL-40 grenade launcher weapon from the game 'The Finals'. The opinions expressed are about other weapons such as the slug shotgun, the FAS, the revolver, the dagger, and the sword, but no mention is made of the CL-40 grenade launcher. The CL-40 grenade launcher for the game 'The Finals' appears to be a topic of concern for the author. The weapon has recently been nerfed, or reduced in power and effectiveness, which the author believes has significantly hindered its performance. The splash damage, which is the area of effect damage a weapon causes, is now so weak that it is compared to blowing farts at the enemy. This reduction in power is frustrating for players who have to use more ammunition to secure a kill, creating an inefficient and unsatisfying gameplay experience. The author seems to empathize with the players who main the CL-40, expressing a sense they have been unfairly disadvantaged by the recent changes to the weapon. The general sentiment towards the CL-40 grenade launcher is negative, with the author suggesting that it needs improvements to be more balanced and enjoyable to use in the game. The user has expressed dissatisfaction with the 'CL-40' heavy grenade launcher in 'The Finals'. They have mentioned that it was the worst weapon in the game but now considers it as the second worst. They state that it is possible to achieve some level of success with this weapon, but it requires a lot of time and effort to master its angles.

They also express relief when they encounter an enemy using this weapon, implying that they do not consider it a significant threat. Therefore, the user suggests that the weapon is underpowered and needs balancing adjustments to make it more competitive.

It's also worth noting that the user seems to enjoy using the riot shield despite acknowledging its shortcomings, demonstrating that the enjoyment of a weapon isn't strictly tied to its effectiveness. They appreciate hearing other players' thoughts and opinions, suggesting a commitment to community engagement and dialogue about the game's balance and design."
