Query,Video ID,Title,Transcript,Opinions
The Finals Medium Grenade Launcher,H_cdh9Rser8,Is This The Better Grenade Launcher in The Finals ?,what's up guys welcome back to another video as promised we're making another video thank you so much for clicking on it and we are going to be revisiting the cl40 this is probably the best grenade launcher available in the finals stick around like subscribe and as always let's get right to the video Let's Go Powerpuff Girls baby but as promised playing more of the finals and of what the hell just happened but yeah we're revisiting the C40 I love this gun um I did make a comparison video oh I can't break that that's great put that up there great okay game game Hates Me game hates me what is going on all right let's go let's go let's go let's go guys let's go I hope I have my grenade launcher reloaded fully where the hell come on get in there bro I hate this game what is going on I suck okay this is why I don't play basketball bro what the I'm done I'm so done done get in there please thank you Jesus all right I don't know what's going on it's definitely me I tell you that I'm hearing a lot of people no no no no damn it Hey listen I got one oh oh he got me okay I love you so much okay okay okay okay put this here throw a grenade I got to reload come on Powerpuff Girl there he is bye that was great okay I had somebody okay we're doing good okay [ __ ] come on come on come on there we go [ __ ] [ __ ] [ __ ] okay where are they going there we go go get out of here all right this guy looks like he's in trouble oh yeah he's dead yeah this is a pretty much an explosive only build pretty much as you can see besides the turret the turret I can't really do much for there we go I'll take the assist let's go get in here boy I did do a breakdown on the gun itself I'll the video up here on the top left or right wherever whichever way guys want to check it out all right where does this take me where the hell where these people at dude I can't see anything I mean so far the team I'm in is doing pretty well oh [ __ ] oh [ __ ] oh [ __ ] I just hit myself where are you [ __ ] no no no no no oh I actually got him holy [ __ ] come oner Nick let's go let's go let's go he just meow I don't know what that was about but all right oh I missed this game for some reason when I was trying to boot it up the game was not opening whatsoever I don't know if it's some something on my end but before the game used to boot up perfectly fine all all it took was me restarting my computer at this point oh [ __ ] yeah I'm dead hey let's go broke his cover watch out buddy there's a land mine right next to you oh there we go all right let's get the tur oh no yeah come in the room please oh yeah my turret is gone there's no way o i mean so far we're playing pretty good defense so oh there you go that's how you inspect oh I took my kill you ass guess I'll put that there whatever oh I def fed oh [ __ ] what's going on oh okay oh see it did one shot me with the RPG but I also wasn't at full health so that's kind of my fault we're going to win this anyways but I'm having a lot of fun and I'm probably still going to upload this because it was fun and uh we'll add another game to it you know we're not going to end it here again the support you guys gave me in the last video was amazing and this is the least I could do show you guys the support let's go we won I mean I got carried if you look at the the stats oh look at that look at that beautiful all right let's get on to the next game all right let's get in there we're back at it with another game as always cuz you know me if you guys don't know me I love ending the video with a W never miss always hit that doesn't make sense whatever oh [ __ ] there's people on the bottom floor let's see if I can break the top floor or something oh [ __ ] oh [ __ ] get down damn it damn it there you go get out of here bye okay I think I see people [ __ ] [ __ ] [ __ ] [ __ ] somebody get him all right we got to head back upstairs and grab that cash cash box or whatever the it's called is it not what okay those first two shots were something I don't know how the hell I didn't hit but I don't know dude there you go get him oh good stuff all right I don't think I need a revive I should be good yep I am all right let's head there guys come on one thing I still haven't tried for the medium build is the Famas I I tried it like a little bit but not had a full game with it if that makes sense all right let's put that there okay get up come on oh he's dead let's go I'll take the W on that kill but yeah I definitely want to try out the Famas I kind of want to like play around with some of the loadouts to see which one would probably be better kind of pair up with the Famas cuz I know Famas is fire rate is a little tricky oh I got him I definitely got assist come on just grab it dude but I know the Famas could be a little tricky based on what I've seen so we need to make sure we get a good pair up with that gun okay they're going to start fighting each other damn it not a good start but so far um we're okay [ __ ] [ __ ] [ __ ] [ __ ] [ __ ] [ __ ] [ __ ] [ __ ] this is not good yeah this is going to get chaotic very soon not not like it's not chaotic already oh hot H hot H okay bad bad why did I do that what the hell is this uh okay I've never seen that before floor fireworks on the floor Jesus yeah he's dead for sure yeah also you guys were telling me somebody told me in the comments that uh like a retro game thing skin for the Mac 11 and that's supposed to be like a Reload cartridge like a game cartridge which is actually pretty dope oh [ __ ] buddy I just spawned leave me alone okay where's this guy I don't need these guys up here nice come on okay it's doing everything but breaking the floor let's put that there there's a lot more space in here than I expected there to Bey watch out out here all right let's be careful now get out of here eat a nut damn it yeah this is not good no and then he gets killed by orange dude this is this game is intense as hell oh my God I thought they had it for a second oh this guy's almost dead he's literally one tapped nice okay he's holding that well all right let's go let's [Music] go oh we got it let's go okay I got nervous I didn't think we were going to get that but we did okay there's people above I don't like that let's get him up yeah yeah where are they I heard somebody oh that's us never mind who has it purple okay purple has it we're good so far rivy and jump jumbo Krabs amazing you guys come by this video love you guys all right let's head there now get him out of here a I was trying to get out of the area there we go good stuff yeah I think I think light builds is just op as hell oh listen if purple gets it fine whatever orange cannot get this cash box oh purple's coming in damn it all right I think we'll be able to catch up it's still time it's still time there we go orange is still up good [ __ ] grab it grab it oh this is going to be [Applause] tough all right we grabbed it this is good this is good again I love ending my games with a W the cl40 is amazing oh man there we go there we go W boys let's go that was great oh man what a match that that was insane for sure the kingfish baby well guys uh as always thank you so much for the support on all the videos not just recent ones but every single video I hope you guys enjoyed this one this is the cl40 love to be using it again um I got to go back to the Famas got to make a video for that for you guys I love you all and as always thank you so much for watching thank you so much for clicking subscribing and as always I'll see you guys in the next one is it not what okay,"The user appears to enjoy using the CL-40 grenade launcher in 'The Finals', referring to it as ""probably the best grenade launcher available"". They seem to have a strong affinity for it, expressing that they ""love this gun"". However, they don't go into detail about the specific aspects of the weapon they like or any potential balancing issues. They mention they made a comparison video but don't provide details on the results or the weapons compared.

The user seems to struggle with some aspects of the game unrelated to the weapon itself. They express frustration several times during their playthrough, but it's unclear if these issues stem from the game mechanics, the weapon, or their skill level. 

In terms of gameplay, they mention using an ""explosive only build"" which might indicate that the CL-40 grenade launcher fits well within this strategy. 

Overall, they seem to enjoy the game and the CL-40, despite occasional frustration. The text doesn't provide specific opinions about the CL-40 grenade launcher in the game 'The Finals'. It seems to depict the player's experiences during a gameplay session, but there's no explicit mention or feedback about the mentioned weapon. Please provide a text that specifically discusses the CL-40 grenade launcher for a detailed analysis. The text provided does not contain any specific opinions or comments about the CL-40 grenade launcher for the game 'The Finals'. The player discusses trying out the Famas weapon and mentions its fire rate being tricky but there is no mention or critique of the CL-40 grenade launcher in this text. The player seems to have very positive opinions about the CL-40 grenade launcher, referring to it as ""amazing"". They seem to enjoy using it, especially towards the end of their games. While they don't go into specifics about weapon balancing, the user's enthusiasm suggests that they find the CL-40 to be a strong and reliable weapon within the medium class. They don't express any dissatisfaction or desire for adjustments, and overall, the sentiment around the CL-40 grenade launcher appears to be quite positive. There is no direct comment on the weapon's balance, so it's unclear if they believe it's overpowered, underpowered, or balanced well within the game."
The Finals Medium Grenade Launcher season 2,H_cdh9Rser8,Is This The Better Grenade Launcher in The Finals ?,what's up guys welcome back to another video as promised we're making another video thank you so much for clicking on it and we are going to be revisiting the cl40 this is probably the best grenade launcher available in the finals stick around like subscribe and as always let's get right to the video Let's Go Powerpuff Girls baby but as promised playing more of the finals and of what the hell just happened but yeah we're revisiting the C40 I love this gun um I did make a comparison video oh I can't break that that's great put that up there great okay game game Hates Me game hates me what is going on all right let's go let's go let's go let's go guys let's go I hope I have my grenade launcher reloaded fully where the hell come on get in there bro I hate this game what is going on I suck okay this is why I don't play basketball bro what the I'm done I'm so done done get in there please thank you Jesus all right I don't know what's going on it's definitely me I tell you that I'm hearing a lot of people no no no no damn it Hey listen I got one oh oh he got me okay I love you so much okay okay okay okay put this here throw a grenade I got to reload come on Powerpuff Girl there he is bye that was great okay I had somebody okay we're doing good okay [ __ ] come on come on come on there we go [ __ ] [ __ ] [ __ ] okay where are they going there we go go get out of here all right this guy looks like he's in trouble oh yeah he's dead yeah this is a pretty much an explosive only build pretty much as you can see besides the turret the turret I can't really do much for there we go I'll take the assist let's go get in here boy I did do a breakdown on the gun itself I'll the video up here on the top left or right wherever whichever way guys want to check it out all right where does this take me where the hell where these people at dude I can't see anything I mean so far the team I'm in is doing pretty well oh [ __ ] oh [ __ ] oh [ __ ] I just hit myself where are you [ __ ] no no no no no oh I actually got him holy [ __ ] come oner Nick let's go let's go let's go he just meow I don't know what that was about but all right oh I missed this game for some reason when I was trying to boot it up the game was not opening whatsoever I don't know if it's some something on my end but before the game used to boot up perfectly fine all all it took was me restarting my computer at this point oh [ __ ] yeah I'm dead hey let's go broke his cover watch out buddy there's a land mine right next to you oh there we go all right let's get the tur oh no yeah come in the room please oh yeah my turret is gone there's no way o i mean so far we're playing pretty good defense so oh there you go that's how you inspect oh I took my kill you ass guess I'll put that there whatever oh I def fed oh [ __ ] what's going on oh okay oh see it did one shot me with the RPG but I also wasn't at full health so that's kind of my fault we're going to win this anyways but I'm having a lot of fun and I'm probably still going to upload this because it was fun and uh we'll add another game to it you know we're not going to end it here again the support you guys gave me in the last video was amazing and this is the least I could do show you guys the support let's go we won I mean I got carried if you look at the the stats oh look at that look at that beautiful all right let's get on to the next game all right let's get in there we're back at it with another game as always cuz you know me if you guys don't know me I love ending the video with a W never miss always hit that doesn't make sense whatever oh [ __ ] there's people on the bottom floor let's see if I can break the top floor or something oh [ __ ] oh [ __ ] get down damn it damn it there you go get out of here bye okay I think I see people [ __ ] [ __ ] [ __ ] [ __ ] somebody get him all right we got to head back upstairs and grab that cash cash box or whatever the it's called is it not what okay those first two shots were something I don't know how the hell I didn't hit but I don't know dude there you go get him oh good stuff all right I don't think I need a revive I should be good yep I am all right let's head there guys come on one thing I still haven't tried for the medium build is the Famas I I tried it like a little bit but not had a full game with it if that makes sense all right let's put that there okay get up come on oh he's dead let's go I'll take the W on that kill but yeah I definitely want to try out the Famas I kind of want to like play around with some of the loadouts to see which one would probably be better kind of pair up with the Famas cuz I know Famas is fire rate is a little tricky oh I got him I definitely got assist come on just grab it dude but I know the Famas could be a little tricky based on what I've seen so we need to make sure we get a good pair up with that gun okay they're going to start fighting each other damn it not a good start but so far um we're okay [ __ ] [ __ ] [ __ ] [ __ ] [ __ ] [ __ ] [ __ ] [ __ ] this is not good yeah this is going to get chaotic very soon not not like it's not chaotic already oh hot H hot H okay bad bad why did I do that what the hell is this uh okay I've never seen that before floor fireworks on the floor Jesus yeah he's dead for sure yeah also you guys were telling me somebody told me in the comments that uh like a retro game thing skin for the Mac 11 and that's supposed to be like a Reload cartridge like a game cartridge which is actually pretty dope oh [ __ ] buddy I just spawned leave me alone okay where's this guy I don't need these guys up here nice come on okay it's doing everything but breaking the floor let's put that there there's a lot more space in here than I expected there to Bey watch out out here all right let's be careful now get out of here eat a nut damn it yeah this is not good no and then he gets killed by orange dude this is this game is intense as hell oh my God I thought they had it for a second oh this guy's almost dead he's literally one tapped nice okay he's holding that well all right let's go let's [Music] go oh we got it let's go okay I got nervous I didn't think we were going to get that but we did okay there's people above I don't like that let's get him up yeah yeah where are they I heard somebody oh that's us never mind who has it purple okay purple has it we're good so far rivy and jump jumbo Krabs amazing you guys come by this video love you guys all right let's head there now get him out of here a I was trying to get out of the area there we go good stuff yeah I think I think light builds is just op as hell oh listen if purple gets it fine whatever orange cannot get this cash box oh purple's coming in damn it all right I think we'll be able to catch up it's still time it's still time there we go orange is still up good [ __ ] grab it grab it oh this is going to be [Applause] tough all right we grabbed it this is good this is good again I love ending my games with a W the cl40 is amazing oh man there we go there we go W boys let's go that was great oh man what a match that that was insane for sure the kingfish baby well guys uh as always thank you so much for the support on all the videos not just recent ones but every single video I hope you guys enjoyed this one this is the cl40 love to be using it again um I got to go back to the Famas got to make a video for that for you guys I love you all and as always thank you so much for watching thank you so much for clicking subscribing and as always I'll see you guys in the next one is it not what okay,"The player seems to enjoy using the CL-40 grenade launcher in 'The Finals' and even states that it is probably the best grenade launcher available in the game. They appear to have a generally positive opinion of the weapon and have even made a comparison video about it. However, no specific feedback about its balance in the game is given. The player also experiences some frustration during gameplay, but these issues seem to be more related to their personal performance and the game's overall mechanics rather than the CL-40 specifically. The player seems to have a positive experience with 'The Finals' game despite some initial technical issues with booting up the game. However, the player didn't specifically express any opinions on the CL-40 grenade launcher or weapon balancing in general. The player didn't face any explicit issues or express dissatisfaction with the weapons used, which might indicate that they find the current state of weapon balancing acceptable. The player also mentions having a lot of fun and enjoying the game, suggesting a positive overall opinion. The text also implies that the player enjoys the competitive aspect of the game, as they express happiness upon winning and disappointment upon being one-shotted with the RPG (although they admit that it was their fault for not being at full health). The text provided does not mention any specific opinions or details about the CL-40 grenade launcher in 'The Finals' game. The user discusses their experiences and strategies with the game, including their interest in trying out the Famas weapon and their struggles during gameplay. They mention using certain weapons and techniques, engaging in combat, and reacting to in-game events, but no explicit comments about the CL-40 grenade launcher are made. The player expresses enthusiasm and satisfaction with the CL-40 grenade launcher in the game 'The Finals'. They found the weapon to be 'amazing' and expressed joy when using it during the gameplay. He also mentioned he 'loves' using the CL-40, suggesting that it is one of his favorite weapons. However, there are no specific details or comments about weapon balancing related to the CL-40 grenade launcher in this excerpt. The player didn't express any concerns or issues with the weapon's performance, implying they believe it to be well-balanced in the game's current state."
The Finals Medium Grenade Launcher season 2,M4sbvqeyocE,do NOT use medium grenade launcher on the finals 😪 #thefinals #thefinalsgameplay #gaming,loses cash together in our tournament matches a team room in the room to the right in the room to the right oh my God this [ __ ] didn't even know I was here and just [ __ ] ran into me man this sh is so stupid bro how how about you stop using that grenade launcher you pull out a [ __ ] for car or akm all right buddy,"From the given text, the user expresses negativity towards the CL-40 grenade launcher in the game 'The Finals'. The user seems to find the grenade launcher overpowered or unfair, suggesting it may be unbalanced compared to other weapons like the car or AKM. This could potentially indicate a need for the game developers to reassess the weapon's balance in the game. There might be a sentiment among players that using the CL-40 grenade launcher requires less skill or strategy, which might be frustrating for other players."
