Query,Video ID,Title,Transcript,Opinions
The Finals Season 2,JCgo3udt6yw,The Finals Season 2 OST,yeah [Music] [Music] [Music] [Music] oh [Music] [Music] oh [Music] [Music] [Music] [Music] w w [Music] [Applause] oh [Music] [Music] w [Music] [Music] [Music] [Music] [Applause] sh [Music] [Music] n [Music] a [Music] [Music] [Music] [Music] [Music] [Music] [Music] n [Music] [Applause] [Music] a [Music] [Music] a [Music] n [Music] [Music] n [Music] [Music] he [Music] la he [Music] he a [Music] [Music] aah w [Music] a [Music] [Music] [Music] [Applause] [Music] n [Applause] [Music] [Music] [Music] [Applause] oh w [Music] a [Music] [Music] w [Music] a,"I'm sorry, but there is no specific information or opinions mentioned about the weapon balancing or the CL-40 grenade launcher for the game 'The Finals' in the text you provided. It appears to be mostly non-verbal sounds and musical notes, which makes it impossible to extract any detailed opinions or insights. Can you please provide a text that contains explicit comments or views about the topic?"
The Finals Season 2,yU7-_EYAJcU,The Finals - Season 2 Trailer | PS5 Games,"The clock is counting down, and the Retros need 
 to make a move to avoid getting  knocked out. Indeed. The Socialites are defending hard and has -- 
 Are you messing with the stream? There seems to be -- Are you ready for something else? We are seers, and we are here to change the game. ♪ ♪ ♪ Closing a gateway. ♪ ♪ ♪ Reshaping. Reversing gravity. Apologies. We seem to be having some technical diff -- But one thing for certain... It will be fun. Take the platform.",The text provided does not contain any specific opinions or feedback about the weapon balancing or the CL-40 grenade launcher in the game 'The Finals'. Could you provide a more specific text that includes feedback or opinions on these topics?
The Finals Season 3,Um4Hyd2yjdk,The Finals Season 3 looks GOOD 👀,the final season 3 is out now and it looks good this game is made by former Battlefield developers that brings a huge amount of Destruction and they've also got some pretty sick Cosmetics if you're into changing your look but the new season brings a ton of new changes and new content including their best map yet theot 1568 is the new map inspired by 16th century Japan and it's packed with temples Gardens and Paper Walls and as usual everything is totally destructible and we've got three new weapons to use the recurve bows for the light class with some medium to long range damage depending on how far you pull back the bow the dual blades are there for the medium class bringing some fast-paced melee action along with a block and deflect and the heavy class has the Spear a melee weapon with some range and some solid damage you've also got two new tools a thermal board that's used to breach a wall and the winch claw that's basically a giant roadhog hook for yanking and stabbing enemies with a spear very cool and if you're really into it they've got an entirely new battle pass with free and paid tiers so you've got something to earn either way let me know down below do you still play the finals what do you think about season 3 and if you haven't checked it out in a while are you going to go back,"The feedback does not provide specific opinions about the CL-40 grenade launcher or weapon balancing in the game 'The Finals'. However, the reviewer does provide detailed opinions about other elements of the new season, including new weapons such as the recurve bows, dual blades, and spear. They also mention new tools like the thermal board and winch claw, as well as the destructible environment of the new map, theot 1568. They praise the addition of new content and changes introduced in the season, and appreciate the game's cosmetic customization. They also highlight the new battle pass system."
The Finals Season 4,42c8P7OBYzg,How the #1 Light DOMINATES Ranked in The Finals Season 4,so in today's video we're back on ranked in the finals as always I'm going to be giving you guys a unique look inside the mind letting you know what's going on in my head as I'm playing basically why I'm doing what I'm doing throughout the entire game I saw a ton of comments letting me know that the M11 is the move right now so that's what we're going to be using in today's video if you have any other build suggestions make sure to leave them in the comments I'm going to be trying out a ton of different builds that you guys suggest to me in the upcoming videos all right let's get into it we're going to contest Vault number one here getting a little crazy early trying to deal some damage from High Ground nice we get that quick aim I'm going to pop an invis and look for a stun play now oh my gosh I'm caught on everything man oh my gosh that got really unlucky I just got caught on that wall so I couldn't move and help my teammate trying to help with this heavy up close now I'm using the dashes just to make him Miss oh unfortunately I go down there get the res off got to just keep fighting for this Vault here I'm going to go for a stun play I'm going to reload go for an invis stun play up close here TR to get in the limb I thought I had my stun in my hand I don't know why I didn't stun the heavy he's going to be low but I know I'm low on ammo so I'm just playing cover nice teammate gets the kill we would have cleaned that up if we had to I think now we look to take Vault and get over to cash out B that's what I'm going to start doing go ahead and take this on over to cash out B not a bad first fight was a little awkward to be honest but that invis stun play is so critical to this build getting up close and making them not have any abilities with the stun is so massive to not just inst dying because you still die really quick on light so the stuns really really important when using this M11 I would say so we're getting ready for purple or pink to make a push and I do spot them we're going to play this High Ground as long as we can try and just get as much damage the m1's really really rough at range so I know I'm not going to do too much so honestly at this point we're getting collapse on I don't know it might be purple and pink it's kind of hard for me to tell it looked like a lot of people so I'm going to kind of fall off and not get too in close until I have to here like right now I might go for an invis play make sure the stuns reloaded unfortunately I accidentally ruined my invis by dashing too early but still kind of worked looking to help get that elimination I see one guy behind me so I'm trying to create space throw that just in case both my teammates are dead at this point so I have to play the delay game a little bit so that's exactly what I'm about to do here I'm just playing the cash out delay we have two two pinks three purples I can delay with the stun I think my teammates need to respawn [Music] here out delaying as much as I can here that's all I'm focused on doing using utility to delay no he's one HP I think we get it though yes we get it I delayed just enough so even though I die there literally the goal is just delay delay delay we use the frag grenades to get him off the point once or twice and I was going to look for an invis stun if I had time but the heavy just sent me so I had to just kind of try to fight it and delay as much as I could works out there pretty perfect we get the point and that was pretty well played to be honest you just have to play the delay sometimes can't worry about kills or anything like that and we're right next to Vault number four so we're going to go ahead and start this up as well now they did already start Cash Out D it looks like orange did that so I think we're just going to go ahead and bring this over to C and I hear a lot of fighting over here so what most likely will happen at this point is we're going to go ahead and start C we might have a team close to us but if we don't oh yep see they're already holding us all good so it looks like they're trying to contest The Vault early that's absolutely fine and it looks like looks like it's pink contesting and there's only one left so I don't know how they died so quick oh my God I just got absolutely melted I just got absolutely melted that might have been the quickest 150 damage I've ever seen but my teammates clean it up so hey it's going to happen sometimes we take it we take the team wipe and now we got to get over to C and get this started so yeah like I was saying we're going to go ahead and get cash out C started here I thought maybe the team would be over by the point already they held us earlier but now they're already pushing back in here and I'm going to try to help my teammate get that first Alim using the invis stun Play That's So free with the M11 because up close this thing just absolutely melts I'm going to see if they go for the revive he's already behind me this is going to be tricky using the dash to get out see if they chase I'm going to go for this kill he's already weak get that kill the teammate's right behind me I don't have a grenade he's weak though so he's not pushing we can use this time to reposition we're going to use the invis for that unfortunately I can't get back up to the cash out in time so I think I just stick the res on my teammate and we regroup somehow it delayed I don't know how the cash out got delayed but they didn't grab it but I think we're not going to have enough time still hopefully I get that kill I do we have two left on pink oh my gosh that fire does so much damage that was my bad I shouldn't have even pushed that popping inis and I want to re hit from the same angle there's a lot of chaos I need to play this smart purple's here too I think I just go for a Cash Out Steel in the midst of all the chaos so I'm going just come oh my gosh this dude just hanging out over here what do we got two purples three pinks they might be up here we're going to start by popping the [Music] invis wow he spots me I thought the invis would do a better job at kind of hiding me there and it also looks like my teammate is just maybe dced or he's AFK I'm not really sure but so unfortunately we do lose that point but we do have time to get over to a um I'm going to try to Res my teammate quick it looks like our other teammate is lagging out or something I'm not sure he's having some kind of issues but all good we'll get our teammate up here looks like our teammate's back now he's moving around and we can go ahead and contest a here everybody's going to be over here there's only 47 seconds left so going to look to third party this late I do not want to get involved too early but we also only have 39 seconds so just this is all about timing really I'm checking who's alive how many are alive and based on that that's when I'm going to enter the fight I think it's a little early now but the teammate's kind of going for it so I'm going to just send some nades in here pop the invis get the stun this dude's going to be low we have two two purple one orange that's a teammate we're going to get on this point I like this stick I think we have time too I'm holding the the door this is really well played this is unfortunate I'm just holding a frag we get this though this is perfectly played to be honest I'll throw frag just in case but yeah we played that absolutely perfect to get that last point that was really well done 6K damage Nine Kills not the most kills are the most damage but what I really loved about that round was how we played the the cash outs the way that we delayed when we needed to the way that we timed our pushes that was a really solid round on uh how to play the cash out points really effectively all right let's get into this second game here head on over to Vault number one so I'm going to take a bit of a wider angle here cuz I'm expecting them to be super headon I'm going to look to pop an invis here and see if I can't get a rat play I might have popped that a little early yeah I popped the invis a little early that's unfortunate but I'm still going to try to look for this R play yeah they just weren't where I was hoping I was hoping they were a little closer they weren't it's pretty unlucky we're going to look for an invis rat play on the left they just hard committed to the right and push my teammates like they just sent it so little unlucky but we can look for the same play again here yeah we got to get out of there see if they chase they might they seem aggressive doesn't don't get any hits on those so I'm assuming they're not chasing I still hear them get the res here on our teammate we just want to get the get the res as quick as we can other teammate will have to probably use a token actually we can just grab him right here I don't know what I'm saying yeah let's go ahead and grab that honestly as my teammate's sticking that res I'm going to start working over to a and look to deal a little damage figure out what's going on in this fight just get a little info here and I already hear somebody trying to steal this point so as we can see we got everybody up and alive so it's really weird that people are able to steal right now but go ahead reload the stun and we're going to look to deal some damage here I'm going to look for this kill no I ran out of ammo see if he chases he doesn't wow I ran out of ammo that was a free kill it's all good though Health starts regening we see one might fall no he makes a jump all right I'm going to use this jump pad to take High Ground back here make sure the stuns reloaded poping inbiz let's try and get involved a little bit see if he chases orange is full dead I'm taking damage from everywhere we're going to reposition to this jump pad we have full purple and full uh Pink I'm expecting them to go for the steel here wow what was that the model yeah that thing does too much damage man if he has any other gun I just insta melt him and back off so we're not going to have time to get over to cash out a so we can just go ahead and move on over to Vault number three pretty unlucky situation there teammates went down kind of early I tried to get involved in the fight as much as I could but just too many teams and we didn't have a full unit so just is what it is I'm going to go ahead and grab The High Ground here as quick as I can just starting fights on The High Ground makes it a lot easier so you don't just get collapsed on but ended up not even having anybody push over and we can just kind of freely go over to cash out D here it looks like sounds like a lot of fighting on the other Vault maybe not really sure now they're kind of close I might look for a kill here this is simply just to weaken the other team by getting rid of one of their numbers like there's not really a purpose to this fight and I don't want to overcommit cuz looking for the kill overc committing for the kill is purposeless right now I was just looking for a free elimination now I have guys on my roof so I'm going to get out of here this is not a situation I want to fight there's not really a point to it I could have maybe got a free kill but he backed off so now we back off we don't want to overc commit to the kill I'm going to start working my way upstairs here not trying to overcommit too much we see one so we know orange is pushing in and I thought I saw Pink as well so already this is starting to look like it's going to get a bit chaotic so high ground's going to be really key here dealing as much damage as we can the M11 is very very weak from range so I know that I'm not dealing much damage there but still applying the pressure making it feel like I'm doing more than I actually am to them can be good sometimes come over here take a different roof just so we're not all kind of stuck on the same spot trying to get some info here see what what these teams are trying to do they're looking for maybe a jump pad play to group up on the roofs dealing a decent amount of damage there actually we have pink and purple here that's going to be a free elimination maybe yes it is oh I kind of get caught there we'll see if they chase I think there's a good chance they do they don't that's crazy now we need like we need to get back to this cash out here it's getting a little scary up we get him off the cash out I tried for the stun I'm not sure what happened we're going to use the frag here trying to just create chaos right now man another frag throwing it on the point just so they can't steal I'm just delaying we're playing the delay game again [Music] no I needed to get out of there but I bought enough time for my teammates to respawn oh we got wiped did they get it I think he might have sold by going for the res first come on yes we get it let's go we play the delay game perfect there again just stacking our utility dealing damage just being annoying that's really how you can still be effective on light even though the meta is kind of medium heavy there is still ways to use light effectively and just like you saw there with the nades the dash the invis it's so annoying to play against they were probably so annoyed that they couldn't just stick the point but it was that delay that we were able to apply now we're close to C so we can look for a play here I'm going to look for the invis stun play as always but this is I got detected so now we got to got to slow it down here can I break that I can okay we don't orange all right so purple and orange are here I saw somebody die but orange is full so it's orange and purple let's open up with a little nade in there try to deal some damage and we have pink we have everybody here got to be aware of this that dude was weak though so is this guy trying to get that kill my aim's a little rough there I'm going to keep it a buck this guy on the stairs can get him as well one left on pink po I think I heard somebody behind me get another one on pink that's a team WIP and we can wrap around here I want to keep looking to fight using the chaos to my Advantage I should res though I think I need to stick a res here I hope this is the medium on our team not the heavy I should have looked quicker it isn't that's fine I'll stick the res insta not a problem maybe my teammate could even stick this trying to get that kill getting lit up in the back my teammates weren't watching it for me little unfortunate but we're going to get a defib here so we're chilling popping invis on our teammates hide out in this corner here that guy's one HP trying to throw a nade behind me in case I do chase another one just in case we need to get back up to that cash out I'm going to reload the stun on my way up try to pop an invis as soon as I can here wait oh there's one to my right it's pink and purple but they're not really fighting each other they're just focusing us it's a little unluck there so the only thing I really could have done differently There Is Res the medium teammate first so he could used the defibrillator on the heavy and that would have bought us a little bit of extra time to maybe go for a steal uh and then just be able to play the delay game so little mistake by me there but it honestly might have cost us that cash out so something to be aware of in the future for sure we do have time here to get to cash out B and try to kind of contest this I saw somebody behind me but I'm going to hit this jump pad look for this elimination on the purple he took out Orange what's we got one orange left it's just the heavy oh I got another one spawning in behind me though and he's one HP or he's going to be half HP my teammates need to clean that up and go for the steel here they do they get the defim oh I'm out I don't have ammo no we're unable to get the point that's a that's tough man 8K damage 10 eliminations and that was a pretty tough tournament that last round there winning that would have been really difficult I thought we played really well to be honest maybe just a couple very small mistakes we could have changed that would have helped us uh get the dub there sometimes that's just how it's going to go especially when you're playing solo Q you got to be okay taking a loss here and there because as long as you're doing what you can that's all you can do so hopefully you guys enjoyed this video and it gave you kind of a look inside my mind as I'm playing and gave you some ideas of things you can Implement into your own gameplay when you guys are playing ranked thank you again so much for all the love and support on the last video it truly means so much to me that you guys have showed me so much love and I am so excited to be back pumping out finals content for you guys so again I hope you guys enjoyed this one as always I hope you guys have an amazing rest of your day I'll catch you in the next video peace,"The provided text does not offer any specific opinions or feedback about the CL-40 grenade launcher weapon in the game 'The Finals'. The player is talking about their experience playing the game using another weapon, the M11, and their strategies during the gameplay. They do mention the importance of using stuns with this weapon, but no further mention or discussion is made about the CL-40 grenade launcher or its balance. The review does not provide detailed opinions or feedback about the weapon CL-40 grenade launcher from the game 'The Finals'. The player seems to be discussing strategies and tactics used during gameplay, notably using delay tactics and utilizing invisibility. The player also mentions using frag grenades, but does not specifically discuss the CL-40 grenade launcher. The text doesn't provide any specific opinion regarding the CL-40 grenade launcher or weapon balancing in 'The Finals' game. It appears to be more of a play-by-play commentary of a match, detailing strategic moves and reactions to other player actions in the game. The speaker mentions using the M11 weapon and its effectiveness in close combat, but no mention of the CL-40 grenade launcher is made. The speaker also does not discuss weapon balancing in this context. The review does not provide specific opinions or feedback about the CL-40 grenade launcher or about weapon balancing in the game 'The Finals'. This is mostly an account of gameplay, detailing strategies and actions taken during the game. There does appear to be some mention of using grenades in the game, but it is unclear if these are from the CL-40 grenade launcher. The reviewer does seem to be satisfied with their overall gameplay strategy, especially in terms of timing their moves and contesting points. The user's opinion about the CL-40 grenade launcher in the game 'The Finals' isn't explicitly mentioned in the given text. The text mostly discusses the user's strategic gameplay, including reviving teammates, repositioning, and attempting to deal damage to opponents. The user does mention running out of ammo at one point, which could imply that they might prefer weapons with larger ammo capacity. They also mention a weapon called 'the model' as dealing too much damage, which might suggest that they feel some weapons in the game could be overpowered or unbalanced. However, without specific reference to the CL-40 grenade launcher, it's impossible to deduce the user's opinion about this weapon. The given text does not provide any specific information or opinions about the CL-40 grenade launcher or weapon balancing in the game 'The Finals'. From the data provided, the player seems to have a generally positive opinion on the CL-40 grenade launcher. The player uses the weapon frequently throughout the game and finds it effective for dealing damage and creating chaos, especially when combined with other utilities. The player mentions the tactic of ""playing the delay game"", using the grenade launcher to delay opponents and buy time for teammates to respawn. The player also finds the grenade launcher useful for dealing with multiple opponents, suggesting it's effective in area control and enforcing some level of area denial. 

However, there's a hint of dissatisfaction towards the current meta of the game, which the player mentions as being ""medium heavy"". This could suggest that the player might appreciate changes that would make light weapons (like the grenade launcher) more viable or impactful in the game. 

It's also worth noting that the player mentions needing to slow down after getting detected, which could suggest that the grenade launcher might not be the best choice for stealth or surprise attacks. 

Overall, it seems like the player appreciates the utility and damage of the CL-40 grenade launcher, but may prefer some changes to the game's meta to make light weapons more viable. The text provided does not contain any explicit opinions or feedback about the CL-40 grenade launcher or weapon balancing in 'The Finals'. The player seems to be describing their gameplay experience and tactics, but they do not mention the CL-40 grenade launcher or comment on the balance of weapons in the game. Unfortunately, there is no specific feedback or opinion mentioned about the CL-40 grenade launcher or weapon balancing in the game 'The Finals' in the text provided. The text mostly covers the speaker's appreciation for continued support and some general thoughts about game strategy in solo play. Please provide a text where the speaker specifically talks about the CL-40 grenade launcher or weapon balancing in the game 'The Finals'."
